termid,courseid,title,prof_string,all_listings_string,area,prereqs,descrip
"1164","010276","Engineering Projects in Community Service (EPICS): Non-credit","Jay B. Benziger Michael G. Littman","EGR 350","","Juniors only (except for sophomores who have completed EGR 251)..","In the Engineering Projects in Community Service (EPICS) program  students earn academic credit for their participation in multidisciplinary design teams that solve technology-based problems for local not-for-profit organizations. The teams are: multidisciplinary--drawing students from across engineering and around the university; vertically-integrated--maintaining a mix of sophomores through seniors each semester; and long-term--each student may participate in a project for up to six semesters. The continuity  technical depth  and disciplinary breadth of these teams enable delivery of projects of significant benefit to the community."
"1164","009655","Contemporary Theories of Gender and Sexuality","Gayle Salamon","GSS 400","SA","GSS 201 or equivalent..","One is not born  but becomes  woman. So writes Simone deBeauvoir in her landmark work of feminism  The Second Sex. But how do we become women  anyway? In this course we will read The Second Sex in its entirety  exploring Beauvoir's ideas  along with our current ones  about childhood  coming of age  the family  sexuality  relationships  work  the social order  and the philosophical imaginary. We will read Beauvoir alongside the work of her primary interlocutors as well as contemporary theory  memoir  and fiction considering the question of what it means to become a woman--or not--in contemporary culture."
"1164","002652","Literature of the American Renaissance  1820-1860","Lee C. Mitchell","ENG 350","LA","","Close study of nine authors--the so-called literary \"renaissance\" of the new republic--who defined a native brand of literature that would influence all subsequent American writers. Our focus will be on narrative and poetic forms that signaled independence from older ideals  offering an exhilarating yet deeply unsettling transition in literary history."
"1164","005391","Political Philosophy - Problems in Contemporary Political Theory","Stephen J. Macedo","POL 518 PHI 529","","","This seminar covers some basic concepts deployed in political thought and practice  looking at the various ways in which they may be institutionally implemented. The concepts discussed include those of the state  the constitution and the people as well as some more regular social concepts like that of agency  corporation  freedom and power."
"1164","001472","Research Methods in Demography","Germán Rodriguez","POP 502 ECO 572 SOC 532","","POP 501/ECO 571/SOC 531 or instructor's permission..","Source materials used in the study of population; standard procedures for the measurement of fertility  mortality  natural increase  migration  and nuptiality; and uses of model life tables and stable population analysis and other techniques of estimation when faced with inaccurate or incomplete data are studied."
"1164","002441","Combustion","Chung K. Law","MAE 531 ENE 531","","","Chemical thermodynamics and kinetics  oxidation of hydrogen  hydrocarbons and alternate fuels  pollutant chemistry and control  transport phenomena  laminar premixed and nonpremixed flames  turbulent flames  ignition  extinction  and flammability phenomena  flame stabilization and blowoff  detonation and blast waves  droplet  spray and coal particle combustion  principles of engine operation."
"1164","005125","Introductory Physics II","Merideth Frey Norman C. Jarosik Catherine K. Visnjic","PHY 102","STL","PHY 101.","This course presents an introduction to the fundamental laws of nature  especially optics  electricity/magnetism  nuclear and atomic theory. These are treated quantitatively with an emphasis on problem solving. The laboratory is intended to give students an opportunity to observe physical phenomena and to gain \"hands-on\" experience with apparatus and instruments."
"1164","013497","Utopia at 500: The Promise of Fiction","Bradin T. Cormack","FRS 102","LA","","See website"
"1164","009577","Topics in African American Literature - African American Literature and the Law","Christopher M. Brown","AAS 392 ENG 392","LA","","A historical overview of black literary expression from the 19th century to present day. Will emphasize a critical and analytical approach to considering the social  cultural  and political dimensions of African American literature."
"1164","006276","Advanced Russian Reading and Conversation II","Ksana Blank","RUS 208","","RUS 207 or permission of instructor..","A continuation of 207. Discussion of some samples of 20th-century poetry and the poets' biographies; review of selected grammar topics; work with two movies."
"1164","013557","Race Relations in Twentieth Century Cuba","Adrian Lopez-Denis","LAS 337","HA","This class will be offered in Havana  as part of the Princeton in Cuba Program. For more information  see: http://www.princeton.edu/oip/sap/programs. Fluency in Spanish..","The Cuban revolution has been one of the most radical sociopolitical experiments of the past century. Comparing historiographical accounts with the recollections of individuals involved in the actual events  this course investigates the impact of the revolutionary process on Cuban racial politics. At the center of our enquire is an attempt to understand how Cubans see themselves in terms of race  and the role of those perceptions on the production of discourses and silences regarding racial inequality and discrimination."
"1164","005438","Formal Political Analysis I","Kristopher W. Ramsay","POL 575","","","A rigorous introduction to choice theory  social choice theory  and non-cooperative game theory. The course serves as the first formal theory graduate course and draws on mathematics at the level of POL 502."
"1164","012303","Intensive Korean II","Eunjung Ji","KOR 108","","KOR 103 and KOR 108 are designed as a year-long sequence. Credit for KOR 103 will not be given unless it is followed by KOR 108. Students who have completed both courses will be considered to have fulfilled the language requirement equivalent to completing two-year study of a foreign language..","A continuation of Korean 103. This course covers the 2nd Year Korean material focusing on complex grammatical structures  reading  and writing. Journals are kept for writing practice. The students who have successfully completed KOR 103 and KOR 108 will be placed in the 3rd or 4th year Korean if they wish to continue."
"1164","008332","Property  Wealth  and Equality","Steven A. Kelts","WRI 123","","","See the Princeton Writing Program website."
"1164","008857","International Trade II","Esteban A. Rossi-Hansberg","ECO 552","","","A continuation of ECO 551  with emphasis on current research issues. Topics vary from year to year."
"1164","006673","Hispanic Studies: Introduction to Cultural Analysis","Manuel-Angel G. Loureiro","SPA 224","LA","Another SPA 200-level course or instructor's permission..","An introduction to the analysis of contemporary cultural texts (narrative  poetry  film  photography) from Latin America and Spain  with the support of various theoretical ideas. The course's main objective is to provide students with a set of strong conceptual  analytical and linguistic skills  which will be of great help in 300-level literature/culture courses."
"1164","013583","Dreams and Nightmares in Hispanic Fiction and Film","Marina S. Brownlee","SPA 214 COM 204","LA","","From Artemidorus in antiquity to Freud in modern times  dreams and nightmares have been a perennial human concern. This course will explore political  philosophical  medical and psycho-sexual representations of dreams and nightmares by such authors as Cervantes  Zayas  Calderón  Cela  Martín Gaite  Muñoz Molina  Bolaño  Piglia and Vargas Llosa."
"1164","001461","Industrial Organization and Public Policy II","Adam Kapor Jakub Kastl","ECO 542","","","Theoretical and empirical study of the public regulation and deregulation of rate of return  prices  and entry in public utilities and franchise oligopolies. Theory and practice of antitrust policy is examined  including some elements of antitrust law. In addition  regulation of product quality  advertising  and safety is examined. This course draws heavily on material developed in 541."
"1164","005131","Advanced Physics (Electromagnetism)","Simone Giombi Peter D. Meyers","PHY 106","STL","PHY 103 or PHY 105..","This course features the classical theory of electricity and magnetism  with emphasis on the unification of these forces through the special theory of relativity. While the subject matter is similar to that of PHY 104  the treatment is more sophisticated. The topics also include DC and AC circuits and the electromagnetic behavior of matter."
"1164","006291","The Great Russian Novel and Beyond: Dostoevsky  Tolstoy  Chekhov  and Others","Ellen B. Chances","SLA 220 RES 220","LA","Curiosity. Knowledge of Russian not required. Open to first-year students as well as to sophomores  juniors  and seniors in any department..","An examination of significant trends in Russian literature from the 2nd half of the 19th century to the Russian Revolution and a bit beyond. The course focuses on many masterpieces of 19th & 20th-century Russian literature. The works (mostly novels) are considered from a stylistic point of view and in the context of Russian historical and cultural developments. The course also focuses on questions of values and on the eternal \"big questions\" of life that are raised in the literature. Authors read include Turgenev  Dostoevsky  Tolstoy  Chekhov  Bely  Nabokov  and Kharms."
"1164","009990","Ecology and Conservation of African Landscapes","Paula G. Kahumbu Robert M. Pringle","EEB 380","STL","Open to students enrolled in the field semester in Kenya.","Only six percent of Africa's land area (containing a fraction of its biodiversity) is protected  and these areas are rarely large enough to sustain wildlife populations. Mostly  wildlife must share land with people also facing survival challenges. This course will explore how wildlife and people interact in Kenya  where new approaches to conservation are being developed. Lectures will cover the ecology of tropical grasslands and first principles underlying conservation and management of these landscapes. Field trips and projects will examine the dynamics between human actions and biodiversity conservation."
"1164","008353","Sex on the Brain","Joseph R. Califf","WRI 143","","","See the Princeton Writing Program website."
"1164","011749","Czeslaw Milosz: Poetry  Politics  History","Irena G. Gross","SLA 395 RES 395","EM","","Polish-American poet Czeslaw Milosz won the Nobel Prize in literature in 1980. In this seminar  which combines textual analyses  history of literature and intellectual history  we will speak on the basis of his major works (and some of his contemporaries - Seamus Heaney  Joseph Brodsky  Derek Walcott)  about World War II  Polish-Russian relations  global dominance of English-language poetry  growth of high culture in the United States  and the decline of exile."
"1164","010412","American Art and Visual Culture - American Realisms and the Perils of Painting","Rachael Z. DeLue","ART 463","LA","","What is realism? How do works of art capture the realities of existence and experience  history and time? What happens when they fail  or when they do their job too well? With such questions in mind  this undergraduate seminar considers realism in American art  focusing on major figures such as Winslow Homer  Thomas Eakins  Henry Ossawa Tanner  Edward Hopper  and Georgia O'Keeffe. We will examine works of art in terms of their historical contexts and also how they intersect with other fields  including religion  science  and literature. Visits to museums  including the PUAM  will be an important aspect of the course."
"1164","012744","Embodied Computation","Axel Kilian","ARC 596","","The emphasis is on learning new methods of developing design  and there are no prerequisites  but a strong motivation to tackle new knowledge and work in an experimental design setting is expected.","Computational design is often presented as a problem solving tool for design implementation rather than as an integral part of design conceptualization and exploration. This seminar focuses on approaching computational design from the conceptual design direction extending existing or defining novel models of design along the way. A strong emphasis is put on prototyping as a mode of design iteration using both computational prototypes and computationally generated physical prototypes as embodiments of the design process."
"1164","001480","Research Program in Development Studies","Anne C. Case","ECO 581","","","Drafts of papers  articles  and chapters of dissertations or books  prepared by graduate students  faculty members  or visiting scholars  are exposed to critical analysis by a series of seminars organized by field. The chief objectives are for the writers to receive the benefit of critical suggestions  for all participants to gain experience in criticism and uninhibited oral discussion  and for students and faculty members to become acquainted with the research work going on in the department. Third- and fourth-year graduate students are expected to attend; first-and second-year students and faculty members are invited to attend."
"1164","010721","Fundamentals of Queueing Theory","William A. Massey","ORF 407","QR","ORF 309.","An introduction to the fundamental results of queueing theory. Topics covered include the classical traffic  offered load  loss and delay stochastic models for communication systems. Through concrete examples and motivations we discuss the theory of Markov chains  Poisson processes and Monte-Carlo simulation. Fundamental queueing results such as the Erlang blocking and delay formulae  Little's law and Lindley's equation are presented. Applications are drawn from communication network systems  inventory management  and optimal staffing."
"1164","012060","Mathematics for Economics/Life Sciences","Jennifer M. Johnson Ilya Vinogradov","MAT 175","QR","MAT103 or equivalent..","Survey of topics from multivariable calculus as preparation for future course work in economics or life sciences. Topics include basic techniques of integration  average value  vectors  partial derivatives  gradient  optimization of multivariable functions  and constrained optimization with Lagrange multipliers."
"1164","006515","Religion and Public Life","Robert J. Wuthnow","SOC 527","","","Presentation and critical discussion of empirical research in progress by participants. Focuses on the use of social science methods in the study of religion and on applications of recently published work about religion and society. Includes an emphasis on religion and public policy in the U.S. and in comparative perspective."
"1164","007243","How to Make a Film","Keith J. Sanborn","VIS 262","LA","This course is now open enrollment.","A film can be fictional or documentary  but there are also many other ways to tell a story. Through hands-on studio work  screenings  critical readings and group critiques  this course teaches the basic tools and approaches for film production with digital media including writing  camerawork  sound  editing  and postproduction. Technical instruction paired with conceptual frameworks will give you the means to find your visual storytelling voice and your filmmaker's point of view."
"1164","006218","Seminar in Romance Linguistics and/or Literary Theory - Levinas and Blanchot","Thomas A. Trezise","FRE 583 COM 583","","","A seminar on the work of Emmanuel Levinas and Maurice Blanchot  following the development  from a common origin in German phenomenology  of the ethics and the aethetics for which they are respectively well known."
"1164","013619","Topics in Architecture: Colonial Cities","Zeynep Celik","ARC 594","","","This seminar examines colonial urbanism from a comparative perspective. The focus is on the long nineteenth century  an era coined as \"the connected world of empires \" and the goal is to open a window to understanding colonialism. The case studies are drawn from colonial cities of European empires  as well as the idiosyncratic Ottoman practices. A comprehensive study of examples ranging from Algiers to Damascus  Calcutta  and Hanoi reveals a spectrum of experiments  each raising different sets of issues in the relationship between colonial policies and built forms."
"1164","013603","Primary Sources in Japanese Literature - Love Letters","Brian R. Steininger","EAS 540","","","This course introduces students to the location  handling  and interpretation of primary sources in the study of premodern Japanese literature and intellectual history. This semester the course focuses on the genre of the love letter  with peripheral attention to broader categories of erotic verse and epistolary writing. Using documents from the fourteenth through nineteenth centuries  students develop proficiency in reading handwritten and woodblock-printed texts using hentaigana and other cursive forms. Students must have prior training in classical Japanese."
"1164","002682","Forms of Literature - Mystery and Detection","Claudia L. Johnson","ENG 402","LA","","Because they foreground issues of interpretation  signs  and narrative  mysteries attract \"high-brow\" readers while maintaining their \"popular\" status. Our class will trace the development of kinds of mysteries -- classics  cozies  noirs  thrillers  post-moderns  metaphysicals -- across historical contexts. Reading theorists such as Freud  Moretti  and Todorov  we will examine the nature of blindspots  doublings  plotting  clues  and suspense  and consider how racial  sexual and cultural difference puts pressure on literary form."
"1164","002656","Topics in American Literature - American Jewish Writers","Esther H. Schor","ENG 356 JDS 377 AMS 359","LA","","American Jewish Writers adopt a variety of personae: they may write as exiles  as citizens  as provocateurs  among other figures. Why these strategies--and what sort of mark have they left on American Jewish writing? On American letters? On modern Jewish literature? We'll consider the historic sweep of American Jewish writing from the 18th to the 21st centuries--and what better time  since the course coincides with the Princeton Art Museum's exhibition on American Jewish life before the Civil War. Students are invited to explore the collection  and develop docent talks as part of their coursework."
"1164","004455","Computer and Electronic Music Composition","Jeffrey O. Snyder","MUS 316","LA","MUS/COS 314 or Permission of the Instructor.","A composition workshop class  in the context of the traditional sound studio. Emphasis will be on the student's creative work  composing both \"fixed media\" works and live electronic/laptop music."
"1164","009392","Special Studies in Modernism - Post-War Realisms: British and Irish Fiction  Documentary and Film","Clair E. Wills","ENG 567 MOD 529","","","This course interrogates critical approaches which read contemporary realism as a legacy of modernism. In the first half of the course we examine a number of 1950s realist and \"documentary\" writers and film-makers  including Alan Sillitoe  Colin MacInnes  John Berger  Edna O'Brien  Philip Donnellan and Doris Lessing  in the context of work by Richard Hoggart and Raymond Williams  and debates on working-class realism  feminism  migration  and the New Left. This literary-historical background form the basis for our examination of later realist writers in the latter half of the course. These texts are chosen by the group."
"1164","013595","Reasoning with Data","","SML 101","QR","There are no official prerequisites for this course. However  it is strongly recommended that students be comfortable with basic computer usage and some college level mathematics..","Data-driven decision-making  research discovery  and technology development are everywhere. It is now more important than ever for individuals to understand how data are used for these purposes. This course will introduce the student to how statistical reasoning and methods are used to learn from and leverage modern data. The emphasis will be on concepts and strategies for learning from data  rather than on sophisticated mathematics. Students will be exposed to the basics of statistics  machine learning  and data science through real world problems and applications. Students will also analyze data sets using the computer."
"1164","007989","Physical Hydrology","Eric F. Wood","CEE 586","","","This course concerns the role of the terrestrial hydrosphere in the climate system.Topics include the role of land within Earth's climate system terrestrial hydrological processes land-atmospheric coupling and precipitation recycling land hydrological sensitivity to projections of global change (land cover and climate). Model parameterizations for terrestrial water and energy models are discussed and developed based on the underlying physics."
"1164","010756","Poverty  Inequality and Health in the World","Angus S. Deaton","WWS 564 POP 564","","WWS 507 and 511. Please see instructor to apply for enrollment..","About well-being throughout the world  with focus on income and health. Explores what happened to poverty  inequality  and health  in the US  and internationally. Discusses conceptual foundations of national and global measures of inequality  poverty  and health; construction of measures  and extent to which they can be trusted; relationship between globalization  poverty  and health  historically and currently. Examines links between health and income  why poor people are less healthy and live less long than rich people."
"1164","007219","Painting","Eve M. Aschheim","VIS 204 ARC 328","LA","","An introduction to the materials and methods of painting. The areas to be covered are color and its interaction  the use of form and scale  painting from a model  painting objects with a concern for their mass and interaction with light."
"1164","007321","Physical Oceanography","Rong Zhang","AOS 573","","","Response of the ocean to transient and steady winds and buoyancy forcing. A hierarchy of models from simple analytical to realistic numerical models is used to study the role of the waves  convection  instabilities  and other physical processes in the circulation of the oceans."
"1164","008024","Special Topics in Statistics and Operations Research - Quantitative Asset Management","Frank J. Fabozzi","ORF 570","","","This course covers asset management focusing on quantitative models applied to equities and bonds (with emphasis on mortgage based securities). The quantitative models discussed are asset allocation models and portfolio construction models that include optimization models (mean variance framework and extensions such as robust portfolio optimization)  multi factor risk models for performance evaluation are covered. Model risk and model/strategy backtesting will be highlighted. Guest speakers from quantitative asset management firms are scheduled."
"1164","007000","Topics in Policy Analysis (Half-Term) - The Federal Budget","Martha B. Coven","WWS 594","","","This course covers how the Federal budget process is supposed to work and how it actually does work. Topics include: (1) institutions  processes  and definitions; (2) history of budget outcomes; (3) the current state of the Federal budget process; (4) the role of uncertainty in budgeting; (4) the role of politics in budgeting; and (5) the budget's short- and long-term fiscal consequences. Students are required to do one or more policy memos."
"1164","004988","Dissertation Seminar","Sarah-Jane Leslie","PHI 599","","","Open to post-generals students actively working on their dissertations. The seminar aims at assisting students in their research and writing and at developing their teaching skills by improving their ability to present advanced material to less expert audiences. Students make presentations of work in progress  discuss each other's work  and share common pedagogical problems and solutions under the guidance of one or more faculty members. It meets for two hours each week throughout the academic year."
"1164","006204","Dante's \"Inferno\"","Simone Marchesi","ITA 303 MED 303","LA","","Intensive study of the \"Inferno\"  with major attention paid to poetic elements such as structure  allegory  narrative technique  and relation to earlier literature  principally the Latin classics. Course conducted in English with highly interactive classes and preceptorials. One precept in Italian will be scheduled on a need-to-be basis."
"1164","004057","Topics in Comparative Literature - Performing the Planet","Rhonda Garelick","COM 370 ENV 372 GSS 370 ENG 379","LA","","An examination of how literature and the performing arts represent and interrogate climate change. The relationship between the human body and the earth  as seen in Classical Drama  early depictions of the New World  texts by early naturalists. The emergence of technologies of seeing and their effects on theater and dance. The relationship between conceptions of the internal body and the body of the earth (geology  landscape  maternity  the microbiome  the Sublime). Environmental theater  eco theater and dance."
"1164","013503","Hogs  Bats  and Ebola: An Introduction to One Health Policy","Laura H. Kahn","FRS 120","SA","","See website"
"1164","013054","Art and Science of Motorcycle Design","Michael G. Littman","FRS 106","STL","","See website"
