termid,courseid,title,prof_string,all_listings_string,area,prereqs,descrip
"1144","002128","Advanced Topics in Computer Science - Mathematical Tecnhiques for Natural Algorithms","Bernard Chazelle","COS 598","","","Reviews fundamental mathematical techniques used in the analysis of natural algorithms. In particular  spectral decomposition  Lyapunov functions  harmonic analysis  statistical and probabilistic techniques  Markov chains  ergodic coefficients  renormalization  and complexity theory."
"1144","012327","Graphic Design: Visual Form","David W. Reinfurt","VIS 216","LA","","This course introduces students to techniques for decoding and creating graphic messages in a variety of media  and delves into issues related to visual literacy through the hands-on making and analysis of graphic form. Graphic design relies on mastering the subtle manipulation of abstract shapes and developing sensitivity to the relationships between them. Students are exposed to graphics from the late 19th-century to the present in slide lectures. Studio assignments and group critique will foster an individual ability to realize sophisticated forms and motivate these towards carrying specific meanings."
"1144","012666","Art as Interaction","Fia Backström","VIS 439","LA","Any 200-level course offered by ART  CWR  DAN  MUS  THR  or VIS.","With roots in political art and community activism  art as interaction inserts itself into public contexts and directly engages its communities and its audience - often with the hope for social change. It endeavors to make social structures as art rather than objects. This class will investigate public art today through readings  case studies  and creating projects that engage the spaces on and around campus. What kinds of societal questions can art pose while still being art? In what ways can forms of collaboration and audience participation be part of artistic practice? Can art provoke social change?"
"1144","006675","Topics in Spanish Literature of the Golden Age - My Brilliant Career--Early Modern Discourses of Ambition","Ronald E. Surtz","SPA 301","LA","A 200-level Spanish course or instructor's permission.","This course studies written accounts of the life trajectories of early modern Spaniards from Spain and Spanish America  examining figures that range from a failed [conquistador] to a cross-dressing ex-nun. We will explore how life experience and literary discourse interact in both biographical and autobiographical texts."
"1144","008639","Qualitative Methods","Andrew Moravcsik","POL 506","","","This seminar provides a broad introduction to research design and analysis for political scientists interested in qualitative research and mixed-method research. The emphasis is on systematic measurement and inferential strategies when considering a few cases in-depth. Topics to be covered include case selection  periodization  comparative-historical analysis  the integration of qualitative and statistical methods  the design and implementation of field research  in-depth interviewing  and archival research. The class will critically practice the implementation of various techniques."
"1144","005157","Advanced Electromagnetism","Suzanne T. Staggs","PHY 304","STN","PHY 104 or PHY 106 or instructor's permission..","Electromagnetic theory based on Maxwell's equations. Electrostatics  including boundary valve problems  dielectrics  and energy considerations leading to the Maxwell stress tensor. Magnetostatics and simple magnetic materials. Electromagnetic waves  retarded potentials and radiation. Familiarity with vector calculus is assumed."
"1144","001548","Biology of Coral Reefs","Stephen W. Pacala","EEB 346","STL","EEB 321 and enrollment in the EEB Spring semester in tropical biology taught in Panama..","This field and lecture course provides an in-depth introduction to the biology of tropical coral reefs  with an emphasis on reef fish ecology and behavior. Each day begins with a lecture  followed by six to eight hours on the water  and ends with data analysis  reading and a discussion of recent papers. Students learn to identify fishes  corals and invertebrates  and learn a variety of field methods including underwater censusing  mapping  videotaping and the recording of inter-individual interactions. Each year group projects will vary depending on previous findings and the interests of the faculty."
"1144","010261","Contemporary Korean Language and Culture II","Joowon Suh","KOR 402","LA","KOR 401 or permission of the instructor..","Reading and discussion of Korean thoughts and issues in contemporary Korea. Readings drawn from a variety of cultural and historical topics. Class discussions will be conducted in Korean."
"1144","008350","Framing American Art","Nicole S. Elder","WRI 140","","","See the Princeton Writing Program website."
"1144","006409","Sociological Theory","Patricia Fernández-Kelly","SOC 302","SA","SOC 101.","This course invites you to systematically review foundational texts in sociology. Attention is given to the formulation of concepts  hypotheses  and research methods. We explore social structure and action; change and conflict; norms and roles; social class and stratification; deviance; and the link between micro- and macro-sociology. We also consider phenomena such as modernization  urbanization  migration  industrialization  and global capitalism. Why does theory matter to contemporary politics and policy? These are among the questions we ask."
"1144","001568","Tropical Ecology","Daniel I. Rubenstein","EEB 521","","","This intensive three week field course takes place during January in a suitable tropical locality. Readings  discussions  and individual projects. The content and location are varied to suit the needs of the participants. Students provide their own travel funds."
"1144","001008","Advanced Quantum Chemistry","Herschel A. Rabitz","CHM 502","","","Traditionally quantum mechanics is presented as the antipode to classical mechanics; as a result  no attempt at reconciliation is made. The primary purpose of the course is to present quantum and classical mechanics in a unified fashion by clarifying only essential differences. We will also see how quantum-mechanical methods can be applied to classical dynamics and how quantum phenomena have classical analogies."
"1144","008351","Framing American Art","Nicole S. Elder","WRI 141","","","See the Princeton Writing Program website"
"1144","008325","Transformations of the Self","Neil J. Young","WRI 115","","","See the Princeton Writing Program website."
"1144","001207","Creative Writing (Fiction)","Jennifer W. Gilmore A.M. Homes Chang-rae Lee Patrick J. McGrath Maaza Mengiste Darcey Steinke Claire V. Watkins Colson Whitehead","CWR 204","LA","Please visit the Creative Writing Program website for application information..","The curriculum allows the student to develop writing skills  provides an introduction to the possibilities of contemporary literature and offers a perspective on the place of literature among the liberal arts. Criticism by practicing writers and talented peers encourages the student's growth as both creator and reader of literature."
"1144","003788","Creative Non-Fiction","John A. McPhee","JRN 240 CWR 240","LA","Applications at http://humanities.princeton.edu. For the writing sample  submit whatever you consider to be your best work  from any source  written since you came to Princeton  including  if you like  a new piece written for the application..","This is a course in factual writing and what has become known as literary nonfiction  emphasizing writing assignments and including several reading assignments from the work of John McPhee and others. Enrollment is limited to 16 second-year students  by application only."
"1144","007240","Relief and Intaglio Printmaking","Daniel A. Heyman","VIS 309","LA","Must have taken: VIS 201/202 or VIS 203/204  VIS 211/212  VIS 221/222  VIS 231/232  VIS 214/215 or VIS 219 also.","This course introduces techniques of copper plate etching  and relief printing. Assignments focus on applications of various printmaking techniques  while encouraging independent development of subject matter. Critiques will occur throughout the term. Students are encouraged to draw regularly outside of class to cultivate themes and content applicable to their prints. Field trips to the University museum and the library's graphics collection will complement class work. Additional independent workshop hours required."
"1144","008029","Special Topics in Dance History  Criticism  and Aesthetics - The Art of Seeing: Choreograpy in the Contemporary Moment","Claudia E. La Rocco","DAN 321","LA","","Dance has long since corrupted and been corrupted by an array of disciplines and traditions. The form can be impossibly esoteric  fraught with politics of gender  sex  race and class; meanwhile Beyonce steals moves from European heavyweight Anne Teresa De Keersmaeker and the performance artist Marina Abramovic fashions a dizzying cult of celebrity. How can audiences keep up? This course proposes that the first  difficult step is really seeing what's in front of you. We will place dance within wider cultural and interdisciplinary contexts  meet with artists and thinkers  and focus on writing as an intellectual and artistic practice."
"1144","003208","Topics in German Intellectual History - Aby Warburg and the History of Science around 1900","Sigrid Weigel","GER 521","","","Aby Warburg is not only the inventor of the concept of \"Kulturwissenschaft\" which he developed on the background of the rediscovery of the \"wild origins of culture\" in the 19th century by means of a transgression of the principals of art history. He was also occupied with the attempt to develop an energetic theory of culture  the expressions of emotions  and the symbolic praxis of mankind. The seminar studies central parts of his publications and then unpublished notes and analyzes them within the scientific thought of his time which were engaged with approaches beyond both myth vs. science and Natur- vs. Geisteswissenschaften."
"1144","006717","Seminar in Modern Spanish Literature - Seminar in Spanish Film","Manuel-Angel G. Loureiro","SPA 543","","NO AUDITS.","An examination of Spanish film since the 50s in the context of international cinema (Ozu  Casssavetes  Fassbinder  Godard  Dardenne  Jia Zhan Ke  Lee Chang Dong  etc). Attention to history and memory  trauma  melancholia  subjectivity and representation  untranslatables  empathy and violence  melodrama  post-theological worlds."
"1144","012614","Introduction to Mathematical Physics","Elliott H. Lieb","PHY 521","","","An introduction to mathematically rigorous methods in physics. Topics to be covered include classical and quantum statistical mechanic  quantum many-body problem  group theory  Schroedinger operators  and quantum information theory."
"1144","012637","Post-1945 African Photography","Chika O. Okeke-Agulu","ART 378 AFS 378 AAS 377","LA","For department majors  satisfies Group 3 distribution requirement..","This course examines the role and status of photography in different phases of Africa's political  cultural and art historical experience since 1945. We explore how African photographers used the photographic medium in the service of the state  society and their own artistic visions during the colonial and post-independence eras. Photography's relationship with art and its social function in Africa will underlie our discussion."
"1144","003423","Gender and Sexuality in Modern America","Margot Canaday","HIS 384 GSS 384","HA","","This course examines the history of gender and sexuality across the 20th century  with emphasis on both regulation and resistance. Topics include early homosexual subcultures; the commercialization of sex; reproduction and its limitation; sex  gender  and war; cold war sexual containment; the feminist movement; conservative backlash; AIDS politics; same-sex marriage; Hillary; and many others."
"1144","010097","Third-Year Modern Chinese II","Joanne Y. Chiang Jincheng Liu Jing Yuan Yunjun Zhou","CHI 304","","CHI 303 or permission of instructor..","A continuation of CHI 303  designed to improve the student's facility in written and oral expression through a close study of newspaper essays and commentaries."
"1144","009387","Senior Thesis","Luigi Martinelli","MAE 442","","","The senior thesis is an independent study for individual students. Work begins in the fall  but enrollment is only in spring term when a double grade is awarded. Students develop their own topic or select a topic from a list of topics prepared by the faculty. Students develop a work plan and select an advisor for their work. A second reader is assigned by the instructor. A written progress report is expected at the end of the fall term. Students submit a written final report and make an oral presentation to faculty  staff  fellow students  and guests at the end of the spring term."
"1144","010479","Korean Cinema","Steven Chung","EAS 351","LA","","Offers a broad historical examination of Korean cinema from both sides of the DMZ. We start with some rare surviving colonial period films and work our way to the very recent films of the \"Korean wave\" era. Our thematic focus will be post-coloniality  ideological division  war  national reconstruction  democratization  and intensified global capitalism; our critical focus will be on problems of nation  class  and gender. At the heart of the work for the course will be attention to the films themselves  where we will try to account critically for shifts in style and form."
"1144","008581","Topics in Policy Analysis (Half Term) - The Development Challenge of HIV/AIDS","Keith E. Hansen","WWS 594","","","This seminar will review the origins of HIV  the multiple impacts of AIDS  the reasons for sustained global neglect  the foundations of effective prevention & treatment programs & the urgent need to improve monitoring & evaluation. Special attention will be given to the role of social factors in the epidemic. Course participants will examine the policy-making process related to global public goods & consider whether the world is better positioned to avert a resurgence of this pandemic or the emergence of the next threat."
"1144","011506","Social and Political Lives of Humor  The","Timothy C. Haupt","WRI 198","","","See the Princeton Writing Program website."
"1144","011116","Acting and Directing in Musical Theater","Ethan J. Heard John Rando","THR 341","LA","THR 201  THR 301  THR 311  THR 366 or THR 411 or MUS 241 or significant experience in the musical form. Please contact the Program Director  Tim Vasen for more information at: tvasen@princeton.edu.","A practical  hands-on introduction to acting and directing in musical theater. The course will require students to prepare songs and scenes from selected musicals with an eye to how best to approach the particular challenges the scene presents."
"1144","012605","The Ballet","Simon A. Morrison","MUS 223","LA","","A history of ballet from its origins in the French courts through its development into a large-scale theatrical spectacle in the 19th century and its modernist deformation. Emphasis will be placed on seminal dancers  choreographers  and composers  nationalist tradition  and socio-political context."
"1144","010931","Politics and Society in the Arabic Novel and Film","Lital Levy","COM 380 NES 380","LA","","This course examines how Arab writers have used fiction and film to address major social and political issues such as displacement  labor migration  war  social repression  and dictatorship. The course covers novels from Egypt  the Sudan  Lebanon  Palestine  Morocco  and Iraq. Topics covered include the Lebanese Civil War  the Palestinian struggle  Islamic fundamentalism  Iraq under the Baathist regime  and the Arab Spring. The course will also look more broadly at experiences of exile and migration and the postcolonial world as reflected in modern Arabic writing. All readings are in English translation."
"1144","010188","Extramural Research Internship","Mung Chiang","ELE 514","","","Full-time research internship at a host institution  to perform scholarly research relevant to student's dissertation work. Research objectives are determined by advisor in conjunction with outside host. A mid-semester progress review and a final paper are required. Enrollment limited to post-generals students for up to two semesters. Special rules apply to international students regarding CPT/OPT use. Students may register by application only."
"1144","010995","Environmental Challenges and Sustainable Solutions","Eileen Zerba","ENV 340","STL","","Course focuses on environmental challenges and sustainable solutions related to interrelationships between constructed and natural processes. Topic areas include climate  air pollution  toxics  and water. The format of the course is experiential learning with problem-solving research projects  lectures  and discussions. A central theme of the projects is to track the impact of land use and sustainable practices on the ecological balance of environments in and around Princeton's campus."
"1144","002412","Optics and Lasers","Julia Mikhailova","MAE 521","","","An introduction to principles of lasers. Topics include propagation theory  interaction of light and matter  Fourier optics  and a description of operational characteristics of lasers  light scattering  and nonlinear optics."
"1144","010855","Epidemiology","Joseph J. Amon","GHP 351 WWS 381","","Completion of an approved basic statistics course (e.g.  ECO 202  EEB/MOL 355  ORF 245  POL 345  PSY 251 or SOC 301)  or completion of an advanced statistics course (e.g.  ECO 302  ECO 312  ORF 405  SOC 404  WWS 200  and WWS 332)..","This required course for GHP students focuses on the distribution and determinants of disease. Diverse methodological approaches for measuring health status  disease occurrence  and the association between risk factors and health outcomes will be presented via classic and contemporary studies of chronic and infectious illness and disease outbreaks. Emphasis on: causal inference  study design and sampling  bias and confounding  the generalizability of research  health policy and research ethics."
"1144","005300","Civil Liberties","Robert P. George","POL 316","EM","","An inquiry into the value of liberty and of particular civil rights and liberties. The course considers competing theoretical justifications for rights and liberties generally  as well as particular problems concerning freedom of speech and the press  religion  sexuality  abortion  and discrimination. Supreme Court opinions regarding the constitutionality of legislation in each of these areas will be discussed and criticized."
"1144","011957","Econometrics and Public Policy: Applications: Basic (Half-Term)","Martin I. Gilens","WWS 508","","WWS 507b.","Provides hands-on experience in the application of econometric methods to policy issues. Various aspects of empirical research in economics will be covered including 1) development of testable hypotheses  2) appropriate use of data  3) specification and estimation of econometric models. The course will be taught using a set of cases in which students apply quantitative methods covered in WWS 507b to data in order to answer specific policy questions. Emphasis will be placed on interpreting and writing about results."
"1144","010438","Media Arabic I","Nizar F. Hermes Eva I. Slowinska","ARA 303","","Successful completion of ARA 107 or the equivalent..","In this course  students will develop their skills in reading and listening to Arabic news media  including newspapers  magazines  websites  radio and satellite TV broadcasts (including BBC and al-Jazeera  among others). Attention will also be given to informal discussion on these subjects  and we will also take a brief look at political cartoons."
"1144","011904","Advanced Persian: Iran through Film","Amineh Mahallati","PER 305","LA","Successful completion of PER 105  or instructor's permission..","This course will engage students thoughtfully with modern Iranian society and politics through documentaries. Each week  students will watch a documentary and prepare for a lively in-class discussion of the issues. Students will be heavily exposed to colloquial Persian."
"1144","000913","Research Projects in Molecular Biology (Laboratory Rotations)","Zemer Gitai","MOL 541","","","Students perform research in the laboratories of potential faculty advisors."
"1144","012739","The Politics of European Integration","Andrew Moravcsik","POL 559","","","This course seeks to explicate and understand the European Union both as a process of international or regional integration  tying existing nation-states such as France  Germany  and the United Kingdom into an 'ever-closer Union of peoples'; and as a polity or political system with its own institutions  policies  and policy processes. The deeper purpose is to give graduate students in politics  public policy and other related disciplines a basic theoretical  substantive and methodological grounding  on the basis of which they can design and conduct original research on the EU."
"1144","012681","Granada and the Fall of Spanish Islam  AD 1212-1492/1614","Michael Barry","NES 354 SPA 371 COM 350","HA","","Thirteenth-century Christian \"Reconquista\" of almost all of Spain after 1212 - with the significant exception of the sultanate of Granada - subjected huge minorities of Muslims and Jews to Christian overlords and challenged the rising kingdoms of Castile  Aragon and Portugal to cope with religious diversity. The course explores how the Christian kingdoms at first imitated and tried to implement Islamic precedents in tolerance but then how social strains spawned increasing sectarian intolerance  mass expulsions or forced conversions of Jews and Muslims  and finally creation of the religiously absolutist monarchies of Spain and Portugal."
"1144","010039","Advanced Arabic Skills Workshop II","Nizar F. Hermes","ARA 402","","Successful completion of ARA 401 or the instructor's permission..","A continuation of ARA 401  focusing on readings in classical Arabic literature. Conducted primarily in Arabic."
"1144","011318","Radical Political Thought","Jan-Werner Müller","POL 305 SOC 320 GER 312","EM","","This course will examine traditions of political thought--mostly  but not only  on the Left--which challenge mainstream conceptions of liberal democracy and modern capitalist society. The main focus will be on Marxism  anarchism  feminism  religious radicalism  ecological thought  and critiques of alienation in everyday life. Particular attention is paid to the relationship between political and cultural criticism  and to the philosophical anthropologies underlying different theories as well as the mechanisms for social change they envisage. We also ask if liberal democratic thought can effectively respond to radical challenges."
"1144","001033","Mechanistic and Physical Organic Chemistry","Abigail G. Doyle Robert R. Knowles","CHM 532","","","This course covers the fundamentals of physical organic chemistry to provide the students with a thorough understanding of chemical reactivity. Within the framework of organic reaction mechanisms  the class discusses a number of topics  including the essence of structure and bonding  the nature of reactive intermediates  and the use of kinetic measurements and isotopic labeling studies to decipher chemical mechanisms. Grades are based on problem sets  a mid-term  and a final exam."
"1144","009638","Ethnographic Tradition","Mitchell Duneier","SOC 551","","","First in a sequence of four modules designed to train graduate students in ethnographic methods. This class introduces students to classical and contemporary works of ethnography that exemplify the contributions this method has made to sociological theory. Weekly readings are drawn from texts on topics such as the social ecology of the city  the study of the self  race and ethnicity  organizational ethnography  disasters  and social movements. Students who select to do original research papers over the course of the entire sequence begin their preparation in this class."
"1144","004322","Introduction to Language and Linguistics","V. Alexandra Teodorescu","LIN 201 ENG 241","EC","","This course is designed to give you an overview of linguistics  the scientific study of language. We will explore many of the major subfields of linguistics and learn some of the techniques used by linguists to describe and analyze language. Topics include the architecture and diversity of human languages  how children acquire language  and how language is stored in the brain  the relationship between language and society  language change and death."
"1144","009929","Biological Oceanography","Bess Ward","GEO 428","","College level chemistry  biology and physics.","Fundamentals of Biological Oceanography  with an emphasis on the ecosystem level. We will consider the organisms in the context of their chemical and physical environment; the properties of seawater  atmosphere and ocean dynamics that affect life in the ocean; primary production and marine food webs; global cycles of carbon and other elements; current research approaches. In addition to lectures by the professors  the course will delve deeply into the current and classic literature of oceanography and students will be expected to participate in seminar type presentations and discussions."
