termid,courseid,title,prof_string,all_listings_string,area,prereqs,descrip
"1164","002612","The 17th Century","Nigel Smith","ENG 326","LA","","The 17th century remains the definitive period for modern literature: many poets from T.S. Eliot to Paul Muldoon and Susan Stewart take crucial inspiration from this time. We will explore Donne  Jonson  Herbert  Marvell  Milton and others in the context of the period's volatile intellectual and political currents  but with an emphasis on literary creativity and originality in a number of genres and forms."
"1164","013085","Government  Poverty  and Inequality in Modern America","Patricia Fernández-Kelly","SOC 355","SA","","The course examines poverty and inequality in relation to processes of globalization that have transformed the means of economic mobility for working people in the U.S. We raise questions about government institutions acting on behalf of different constituencies and according to varying criteria of economic \"deservedness;\" and evaluate vibrant debates about the role of democratic government in promoting social justice. Among the subjects covered are poverty and religion  social and cultural capital among the poor  and poverty  crime  incarceration  and entrepreneurship."
"1164","012256","World Drama","Robert N. Sandberg","ENG 380 COM 358","LA","","This course is a survey of classical and modern drama from Africa  China  India  Japan  and Latin America. Topics will include Noh and Kabuki  Beijing Opera  Sanskrit theater  Nigerian masquerades and a variety of selections from the rich modern Indian and Latin American canons. There may be trips to NYC or locally to see new theater works."
"1164","006409","Sociological Theory","Patricia Fernández-Kelly","SOC 302","SA","SOC 101.","This course invites you to systematically review foundational texts in sociology. Attention is given to the formulation of concepts  hypotheses  and research methods. We explore social structure and action; change and conflict; norms and roles; social class and stratification; deviance; and the link between micro- and macro-sociology. We also consider phenomena such as modernization  urbanization  migration  industrialization  and global capitalism. Why does theory matter to contemporary politics and policy? These are among the questions we ask."
"1164","001568","Tropical Ecology","Andrew P. Dobson","EEB 521","","","This intensive three week field course takes place during January in a suitable tropical locality. Readings  discussions  and individual projects. The content and location are varied to suit the needs of the participants. Students provide their own travel funds."
"1164","001008","Advanced Quantum Chemistry","Denys I. Bondar Herschel A. Rabitz","CHM 502","","","Traditionally quantum mechanics is presented as the antipode to classical mechanics; as a result  no attempt at reconciliation is made. The primary purpose is to present quantum and classical mechanics in a unified fashion by clarifying only essential differences; also  how quantum-mechanical methods can be applied to classical dynamics and how quantum phenomena have classical analogies; special emphasis on open quantum and classical system dynamics."
"1164","013563","Communicating Science and Technology in the Modern World","Craig B. Arnold Daniel J. Steinberg","MSE 407","","Open to juniors and seniors. Sophomores and freshmen may enroll with permission of the instructor..","One of the most important skills science and engineering professionals can develop in their career is the ability to communicate their research. This course  aimed at science and engineering students  is not intended to be a journalism course or a teacher education course but rather seeks to familiarize students with concepts and methods to effectively communicate technical content to a wide array of audiences. Practical science communication and educational theories will be examined. Students learn from hands-on methods focusing on interactions with the public  guest lecturers  assigned readings  discussion  and project development."
"1164","001207","Creative Writing (Fiction)","A.M. Homes Fiona Maazel Sigrid Nunez Hanna Pylväinen Darcey Steinke Edmund V. White","CWR 204","LA","Interested students complete an application (arts.princeton.edu/cwr-app) and include a writing sample of 3-4 pages of fiction. No prerequisites. Application deadline is November 22  2015..","The curriculum allows the student to develop writing skills  provides an introduction to the possibilities of contemporary literature and offers a perspective on the place of literature among the liberal arts. Criticism by practicing writers and talented peers encourages the student's growth as both creator and reader of literature."
"1164","003788","Creative Non-Fiction","John A. McPhee","JRN 240 CWR 240","LA","Applications at http://humanities.princeton.edu/journalism/courses. For the writing sample  submit whatever you consider to be your best work  from any source  written since you came to Princeton  including  if you like  a new piece written for the application. Application deadline is November 18  2015..","This is a course in factual writing and what has become known as literary nonfiction  emphasizing writing assignments and including several reading assignments from the work of John McPhee and others. Enrollment is limited to 16 second-year students  by application only."
"1164","013616","Ethics for Scientists (Half-Term)","Michael J. Berry","NEU 592","","","Consistent with requirements of federal training grants  this class broaches significant ethical issues that face scientists. These issues include: i) scientific integrity & misconduct; ii) mentoring; iii) peer review in grants and papers; iv) humans subjects and animals in research; v) collaborations and conflicts of interest; vi) the scientist as a responsible member of society. Students read case studies before each class. The instructor provides background lecture  then the students discuss ethical issues raised in the case studies. In addition  two faculty members are invited to each class to provide additional perspective."
"1164","007240","Introductory Printmaking","Daniel A. Heyman","VIS 309","LA","MUST have taken: Any one 200-level VIS course..","This course introduces techniques of copper plate etching  and relief printing. Assignments focus on applications of various printmaking techniques  while encouraging independent development of subject matter. Critiques will occur throughout the term. Students are encouraged to draw regularly outside of class to cultivate themes and content applicable to their prints. Field trips to the University museum and the library's graphics collection will complement class work. Additional independent workshop hours required."
"1164","013488","Ethics and Pathologies of Attachment","Monique L. Wonderly","CHV 332 PHI 347","EM","","This course will examine issues at the intersection of emotional attachment  ethics and agency theory. In particular  we will consider whether and how disordered attachment orientations might bear on questions concerning the moral agency and ethical treatment of members of certain clinical populations  including psychopaths and those who suffer from (certain forms of) addiction. In exploring these issues  we will engage with recent literature on moral responsibility  autonomous agency  and bioethical approaches to understanding the nature and treatment of the aforementioned pathologies."
"1164","008029","Special Topics in Dance History  Criticism  and Aesthetics - Moving Modernisms","Judith Hamera","DAN 321 AMS 361 GSS 387","LA","None. No prior dance experience is necessary..","How did concert dancers and choreographers create and respond to modernity's fascination with mobility between 1900 and 1950? We answer this question by probing ways gender  race  and sexuality shaped ideas of the modern in the dances of Isadora Duncan  Vaslav Nijinsky  Martha Graham  Katherine Dunham  Zora Neale Hurston  and others. Emphasis on dancers in the U.S.  including transnational choreographies of African American artists  with comparative case studies from Europe. Special attention to the ways fieldwork informed choreography. Includes trip to NYPL Robbins Dance Division. No dance experience required."
"1164","003208","Topics in German Intellectual History - Mysticism and Modernity","Niklaus E. Largier","GER 521 MED 521 MOD 542","","","So-called 'mystical' forms of thought and experience have played a major role in the history of modern philosophy and literature from Hegel to Lukàcs  Heidegger  Bataille  and Derrida  and from Novalis to Musil  Celan  Bachmann  Klossowski  and Cage (to name just a few). In this seminar we first read key medieval and baroque texts. Based on the class discussion and on individual student interests  we then look into the ways how these texts have been read by 19th and 20th century authors and explore the impact they had on the discussion of modern concepts of subjectivity  affect  and agency."
"1164","010400","Intermediate Czech II","Mark R. Pettus","CZE 107","","CZE105.","A continuation of CZE105. Advanced grammar topics  building of vocabulary through studying Czech word formation and reading challenging samples of Czech literature (prose  poetry  drama). Continuing practice in oral communication. Three hours per week. Prerequisite: CZE105 or with instructor's consent."
"1164","013489","From Pandora to Psychopathy: Evil from Antiquity to the Present","Christian Wildberg","CLA 255 PHI 255 CHV 255","EM","","This lecture course introduces students to the ways in which humanity has grappled with the existence of evil. The focus lies not on natural evils (such as earthquakes and epidemics) but on moral evil  in particular on the critical examination of the many theories and explanations of human wickedness. The course is highly interdisciplinary. It will take into account not only the literature and imagery of various genres and periods  but also feature invited lecturers from Religion  Philosophy and Psychology to empower the class to evaluate and critique contemporary views and prejudices about the nature and origin of moral evil."
"1164","012614","Introduction to Mathematical Physics","Michael Aizenman","PHY 521 MAT 597","","","An introduction to mathematically rigorous methods in physics. Topics to be covered include classical and quantum statistical mechanic  quantum many-body problem  group theory  Schroedinger operators  and quantum information theory."
"1164","003423","Gender and Sexuality in Modern America","Margot Canaday","HIS 384 GSS 384","HA","","This course examines the history of gender and sexuality across the 20th century  with emphasis on both regulation and resistance. Topics include early homosexual subcultures; the commercialization of sex; reproduction and its limitation; sex  gender  and war; cold war sexual containment; the feminist movement; conservative backlash; AIDS politics; same-sex marriage; Hillary; and many others."
"1164","010097","Third-Year Modern Chinese II","Shutan Dong Luanfeng Huang Jincheng Liu Xin Zou","CHI 304","","CHI 303 or permission of instructor..","A continuation of CHI 303  designed to improve the student's facility in written and oral expression through a close study of newspaper essays and commentaries."
"1164","009387","Senior Thesis","Luigi Martinelli","MAE 442","","","The senior thesis is an independent study for individual students. Work begins in the fall  but enrollment is only in spring term when a double grade is awarded. Students develop their own topic or select a topic from a list of topics prepared by the faculty. Students develop a work plan and select an advisor for their work. A second reader is assigned by the instructor. A written progress report is expected at the end of the fall term. Students submit a written final report and make an oral presentation to faculty  staff  fellow students  and guests at the end of the spring term."
"1164","010479","Korean Cinema","Steven Chung","EAS 351","LA","","Offers a broad historical examination of Korean cinema from both sides of the DMZ. We start with some rare surviving colonial period films and work our way to the very recent films of the \"Korean wave\" era. Our thematic focus will be post-coloniality  ideological division  war  national reconstruction  democratization  and intensified global capitalism; our critical focus will be on problems of nation  class  and gender. At the heart of the work for the course will be attention to the films themselves  where we will try to account critically for shifts in style and form."
"1164","000878","Genetics","Mark D. Rose Gertrud M. Schupbach","MOL 342","STN","MOL 214 or 215 or by permission of instructor.","Basic principles of genetics illustrated with examples from prokaryote and eukaryote organisms with emphasis on classic genetic techniques. The evolving conception of the gene and genome will be the primary focus of the course. Selected advanced topics will include Drosophila developmental genetics  yeast cell biology and human disease."
"1164","011506","Social and Political Lives of Humor  The","Timothy C. Haupt","WRI 198","","","See the Princeton Writing Program website."
"1164","011116","Acting and Directing in Musical Theater","John Rando","THR 341","LA","THR 201  THR 301  THR 311  THR 335 or THR 411 or MUS 241 or significant experience in the musical form. Please contact the Program Director  Tim Vasen for more information at: tvasen@princeton.edu.","A practical  hands-on introduction to acting and directing in musical theater. The course will require students to prepare songs and scenes from selected musicals with an eye to how best to approach the particular challenges the scene presents."
"1164","013553","Mathematical Tools for Neuroscience","Jonathan W. Pillow","NEU 314","","Students should have already taken the math prerequisites for the neuroscience major. Linear algebra and some programming experience are helpful  but not required. We do not assume experience with Matlab  but some basic familiarity would be helpful..","This lecture course will cover mathematical  statistical  and computational tools necessary to analyze  model  and manipulate neural datasets. A primary goal of the course will be to introduce students to key concepts from linear algebra  dynamical systems  and probability and statistics  with an emphasis on practical implementations via programming. Lectures on each topic will focus on relevant mathematical background  derivation of basic results  and examples relevant to neuroscience. The course will include problem sets based on the MATLAB software package."
"1164","013567","Immigration Politics and Policymaking in the U.S.","Ali A. Valenzuela","POL 334 SOC 333 LAO 334","SA","","Founded and built by immigrants  the U.S. has a complicated relationship with newcomers. How have politics shaped U.S. immigration policy and with what effects on the character of inflows and American identity? Are changing demographics tied to exclusionary attitudes and public views about immigration policy? Do Hispanic attitudes conform to nativist fears? What role do norms  culture and economics play in public attitudes about immigrants? Do members of Congress follow their constituents' preferences when voting on immigration policy? This class will tackle these and related questions about immigration politics and policymaking in the U.S."
"1164","010188","Extramural Research Internship","Mung Chiang","ELE 514","","","Full-time research internship at a host institution  to perform scholarly research relevant to student's dissertation work. Research objectives are determined by advisor in conjunction with outside host. A mid-semester progress review and a final paper are required. Enrollment limited to post-generals students for up to two semesters. Special rules apply to international students regarding CPT/OPT use. Students may register by application only."
"1164","000650","Seminar in Medieval Art - Byzantine and Medieval Manuscripts","Charles E. Barber Beatrice E. Kitzinger","ART 537 MED 500 HLS 534","","","The course explores the fields of Byzantine and western manuscript illumination through categories of medieval books that offer scope for dissertation in both traditions. Case studies of key examples structure the sessions and the reading list. Course bibliography includes both fundamental and recent works; an emphasis on method and historiography in art history's approach to manuscript studies is a focus of the class. The course concludes with a formal colloquium and will include time in both Princeton and New York collections."
"1164","004919","Metaphysics","Boris C. Kment","PHI 318","EC","","A survey of central issue in metaphysics  such as: What is time? Is it true that the past is fixed and immutable while the future is a branching tree of alternative possibilities? Or could we in principle change the past? What makes a certain object at one time identical with a certain object at a later time? Are human beings truly free  or are their actions determined by factors beyond their control? Or both?"
"1164","012233","Topics in Empirical Macroeconomics","Atif R. Mian","ECO 507","","","This course is geared towards (i) understanding how finance and the macro economy interact with each other  and (ii) introducing micro-empirical techniques and data sets for answering traditional macro questions. The focus of the class is empirical but we begin each topic with a discussion of its theoretical foundation."
"1164","010855","Epidemiology: an ecological and evolutionary perspective","C. Jessica E. Metcalf","GHP 351 WWS 381","","Completion of an approved basic statistics course (e.g.  ECO 202  EEB/MOL 355  ORF 245  POL 345  PSY 251 or SOC 301  SML 101 and SML 201)  or completion of an advanced statistics course (e.g.  ECO 302  ECO 312  ORF 405  SOC 404  WWS 200  and WWS 332)..","This required course for GHP students focuses on the distribution and determinants of disease. Diverse methodological approaches for measuring health status  disease occurrence  and the association between risk factors and health outcomes will be presented via classic and contemporary studies of chronic and infectious illness and disease outbreaks. The core underlying ecological and evolutionary drivers of human health will be introduced. Emphasis on: causal inference  study design and sampling  bias and confounding  the generalizability of research  health policy and research ethics."
"1164","005300","Civil Liberties","Keith E. Whittington","POL 316","EM","","An exploration of how the United States has grappled with the limits on government power. The rights of individuals  and the justification for the use of force from the founding period to today. Topics include religious liberty  free speech  economic liberty  equality and personal autonomy  and security issues."
"1164","011957","Econometrics and Public Policy: Applications: Basic (Half-Term)","Cecilia E. Rouse","WWS 508","","WWS 507B.","Provides hands-on experience in the application of econometric methods to policy issues. Various aspects of empirical research in economics will be covered including 1) development of testable hypotheses  2) appropriate use of data  3) specification and estimation of econometric models. The course will be taught using a set of cases in which students apply quantitative methods covered in WWS 507b to data in order to answer specific policy questions. Emphasis will be placed on interpreting and writing about results."
"1164","010438","Media Arabic I","Hannah Essien","ARA 303","","Successful completion of ARA 107 or the equivalent..","In this course  students will develop their skills in reading and listening to Arabic news media  including newspapers  magazines  websites  radio and satellite TV broadcasts (including BBC and al-Jazeera  among others). Attention will also be given to informal discussion of current news  and we will also take a brief look at political cartoons."
"1164","011904","Advanced Persian: Iran through Film","Amineh Mahallati","PER 305","LA","Successful completion of PER 105  or instructor's permission..","This course will engage students thoughtfully with modern Iranian society and politics through documentaries. Each week  students will watch a documentary and prepare for a lively in-class discussion of the issues. Students will be heavily exposed to colloquial Persian."
"1164","011925","Genes  Brain  and the Human Mind","Samuel S. Wang","MOL 451 NEU 451","SA","","How did the human brain become the most complex organ in the animal kingdom? How do genetic and environmental forces produce its capabilities and maladies? These questions have fascinated philosophers  humanists  physicians  and scientists for millennia and will be the focus of this course. The course will use human genetics and systems neuroscience to analyze topics including autism  Alzheimer disease  bipolar disorder and drug addiction. Class time will emphasize lectures  discussion  and student-generated presentations. The goal is to reach a modern understanding of how the human brain works and sometimes fails."
"1164","000913","Research Projects in Molecular Biology (Laboratory Rotations)","Zemer Gitai","MOL 541","","","Students perform research in the laboratories of potential faculty advisors."
"1164","011692","Readings in Western American History","Martha A. Sandweiss","HIS 582","","","This readings course focuses on the central problems engaged by recent scholarship on the American West  with particular attention given to how this regional history intersects with the larger thematic concerns of national history. Topics to be addressed include environmental history  Native American history  race  gender  urban history and popular culture."
"1164","013548","France and its Empire  1500-1815","David A. Bell","HIS 364 FRE 374 ECS 364","HA","","A survey of France and its colonial empire during centuries in which this country dominated the Western world. Major topics include the sixteenth-century Wars of Religion  the absolute monarchy  colonization and slavery in North America and the Caribbean  the Enlightenment  eighteenth-century social and cultural change  the French Revolution and the Terror  the Haitian Revolution  and the Napoleonic Empire."
"1164","012392","Topics in Number Theory and Related Analysis - Integer points on affine varieties","Peter C. Sarnak","MAT 515","","For advanced level undergraduates and graduate students..","We discuss some basic problems and applications of strong approximation for integer points on affine varieties. We spend some time on some of the classical tools to address such problems such as the circle method and then turn to more recent and special techniques connected with the action of groups of affine morphisms."
"1164","012681","Granada and the Fall of Spanish Islam  AD 1212-1492/1614","Michael Barry","NES 354 COM 350","HA","","Thirteenth-century Christian \"Reconquista\" of almost all of Spain after 1212 - with the significant exception of the sultanate of Granada - subjected huge minorities of Muslims and Jews to Christian overlords and challenged the rising kingdoms of Castile  Aragon and Portugal to cope with religious diversity. The course explores how the Christian kingdoms at first imitated and tried to implement Islamic precedents in tolerance but then how social strains spawned increasing sectarian intolerance  mass expulsions or forced conversions of Jews and Muslims  and finally creation of the religiously absolutist monarchies of Spain and Portugal."
"1164","011318","Radical Political Thought","Jan-Werner Müller","POL 305","EM","","This course will examine traditions of political thought--mostly  but not only  on the Left--which challenge mainstream conceptions of liberal democracy and modern capitalist society. The main focus will be on Marxism  anarchism  feminism  religious radicalism  ecological thought  and critiques of alienation in everyday life. Particular attention is paid to the relationship between political and cultural criticism  and to the philosophical anthropologies underlying different theories as well as the mechanisms for social change they envisage. We also ask if liberal democratic thought can effectively respond to radical challenges."
"1164","002554","Selected Topics in Solid-State Electronics - Physics & Technology of Low-Dimensional Semiconductors","Mansour Shayegan","ELE 548","","","A broad overview of materials science and physics of low-dimensional semiconductor structures will be presented. Emphasis will be on the fabrication and physics of high-mobility carrier systems in modulation-doped structures. Examples include two-dimensional  one-dimensional (quantum wire)  and zero-dimensional (quantum dot) systems."
"1164","004322","Introduction to Language and Linguistics","Lauren J. Ross-Feldman","LIN 201 ENG 241 CGS 205","EC","","An introduction to the scientific analysis of the structure and uses of language. Core areas covered include phonetics and phonology  morphology  the lexicon  syntax  semantics and pragmatics  with data from a wide range of languages. Topics include the biological basis of language  language and cognition  the neurology of language and language disorders  and first and second language acquisition."
