termid,courseid,title,prof_string,all_listings_string,area,prereqs,descrip
"1164","007992","Special Topics in Environmental Engineering and Water Resources - Interfacial Water in Natural Systems","Ian C. Bourg","CEE 599","","","This course examines and discusses current research on the behavior of interfacial water in natural systems. Topics covered include adsorption at water-solid and water-air interfaces  the thermodynamics of adsorbed water films  interfacial mass transfer  interfacial energy and wetting  colloidal aggregation in saturated and unsaturated soils  surface waters  and the atmosphere. The course focuses particularly on insights gained from the combination of experiments  atomistic simulation  and geochemical models."
"1164","005277","Political Theory","Melissa Lane","POL 210","EM","This course is open to first year students.","This course explores ideas of individual ethics and political community  the ethics of political rule  freedom and slavery  democracy and representation  and equality and inequality in political thought. Readings will be drawn from both canonical and contemporary authors  including Sophocles  Machiavelli  Locke  Rousseau  and Tocqueville. This is an introductory course  which emphasizes both thematic and historical approaches to political theory  and its role in informing contemporary civic engagement."
"1164","008624","Digital Journalism - Writing about Digital Culture","David Kushner","JRN 452","SA","If the course fills  you may email ldetitta@princeton.edu to be put on the waiting list. Please include a paragraph about the reasons for your interest in the course..","Digital culture is rapidly transforming our world. This course covers the essentials of chronicling this new technology and the lives of its creators and consumers. It's about learning to apply your skills of observation and analysis to fast-moving targets: social networks  video games  hackers  and more. Reporting these stories of innovation  obsession  and empowerment touches on the realms of art  business  policy  and science."
"1164","011771","Health Economics II","Anne C. Case Angus S. Deaton","ECO 566","","","Examines issues in global health. Specific topics include effects of health on growth and development; health  nutrition and productivity; the relationship between health and height; the relationship between education and health; structural problems in health service delivery in developing countries; and the impact of the AIDS crisis on economic wellbeing; measurement of health and well-being around the world. Prerequisites: PhD-level microeconomics and econometrics."
"1164","013551","Ethnicity and History","Nino Luraghi Helmut Reimitz","HUM 322 CLA 322 HIS 447","HA","","We live in the age of ethnicity. The surge of ethnic conflicts after the collapse of the Soviet Union has brought dramatically to the fore the importance of ethnicity as a motive for social action  often violent. Ethnic difference is a key factor employed to explain social inequality in the Global North. In the United States  ethnicity and race are official categories applied by governmental agencies in dealing with discrimination and poverty. In this course  students will look at ethnicity as a historical phenomenon that happens in different times and places  and become familiar with theories and methods as well as case-studies."
"1164","011778","Responsible Conduct in Research: A Course on Ethics in Engineering (Half-term)","Claire F. Gmachl","EGR 501","","This course is required for graduate students in engineering who participate in federally funded research; the course is highly recommended and/or required for undergraduate students as well as post-doctoral researchers in engineering who participate in federally funded research. There are no prerequisites for attending the course..","This course educates the graduate student of engineering in the responsible conduct of research. The lectures provide theoretical background information as well as case studies about ethics in day-to-day research situations  in publishing and peer-review  in student-advisor relationships  in collaborative research  as well as in the big picture and considerations of long-term impact. The students are provided with resources to consult in ethical questions."
"1164","006910","Topics in International Relations - Human Rights","Gary J. Bass","WWS 556","","","This course looks at human rights as a public policy issue. It considers debates over the definition of human rights; the possibilities and limits of humanitarian intervention; the ability of human rights activists and international actors to undermine dictatorial governments; and the impact of the laws of war. We will consider historical and contemporary cases around the world  including the Armenian genocide  the Holocaust  Bosnia  China  and more."
"1164","013512","Soviet-Satellite Relations and Russia's Conflict with Ukraine","Marzenna James","FRS 150","SA","","See website"
"1164","001035","Modern Methods for Organic Synthesis","David W. MacMillan Erik J. Sorensen","CHM 534","","One full year of undergraduate organic chemistry.","This course exposes you to many types of carbon-based molecular structures  the transformations they undergo  and many kinds of chemical reactions and strategies that are important to the field of organic synthesis. Recent advances in asymmetric catalysis  cascade and other complexity-generating structural transformations  and powerful strategies for chemical synthesis that evolved from ideas about the structural origins of important  biologically active molecules such as steroid hormones  cofactors  and alkaloids are addressed."
"1164","002074","Information Security","Prateek Mittal","COS 432 ELE 432","","COS 217 and COS 226..","Security issues in computing  communications  and electronic commerce. Goals and vulnerabilities; legal and ethical issues; basic cryptology; private and authenticated communication; electronic commerce; software security; viruses and other malicious code; operating system protection; trusted systems design; network security; firewalls; policy  administration and procedures; auditing; physical security; disaster recovery; reliability; content protection; privacy."
"1164","013499","Afterlives of The Iliad","Karen R. Emmerich","FRS 108","LA","","See website"
"1164","013536","Introduction to Digital Humanities","Claude Willan","ENG 349 HUM 346","LA","","Have you ever wondered how to measure the complexity of a literary text? What if you could map the personal connections in a Jane Austen novel or a Shakespeare play? Have you had an intuition that you haven't been able to follow because processing the information was too intimidating? If so  the digital humanities can help you. This course will explore the large and exciting field of digital humanities. You'll learn how to read and understand texts using DH methods and will start your own DH project."
"1164","013516","Listening In: Sonic Culture in American History","Emily Thompson","FRS 166","HA","","See website"
"1164","012600","Human Evolution","Janet M. Monge","ANT 206","EC","","An investigation of the evidence and background of human evolution. Emphasis will be placed on the examination of the fossil and other evidence for human evolution and its functional and behavioral implications. (See ANT 206B/ EEB 306 to determine the appropriate course for enrollment.)"
"1164","011441","Graphic Design","Alice Chung","VIS 214 ARC 214 CWR 214","LA","","This studio course will introduce students to the essential aspects and skills of graphic design  and will analyze and discuss the increasingly vital role that non-verbal  graphic information plays in all areas of professional life  from fine art and book design to social networking and the Internet. Students in the course will explore visual organization through a series of focused  interrelated assignments dealing with composition  page layout  type design  and image. Hands on production will include an array of do-it-yourself printing and distribution technologies  from letterpress and mimeograph to photocopying and websites."
"1164","002503","Embedded Computing","Niraj K. Jha","ELE 464","","ELE 375..","Introduction to embedded computing  cyberphysical systems and Internet-of-Things basic concepts; reliability  availability  power/energy consumption  security. Finite-state machines. Sensors and actuators. Embedded processors. Performance/power analysis. Real-time systems. System-on-chip architectures. Hardware-software co-design. High-level synthesis. Low-power embedded system design."
"1164","000743","General Plasma Physics II","Hantao Ji","AST 552","","","This is an introductory graduate course in plasma physics  focusing on magnetohydrodynamics (MHD) and its extension to weakly collisional or collisionless plasmas. Topics to be covered include: the equations of MHD and extended MHD  the structure of magnetic fields  static and rotating MHD equilibria and their stability  magnetic reconnection  MHD turbulence  and the dynamo effect. Applications are drawn from fusion  heliophysical  and astrophysical plasmas."
"1164","013466","Urban Worlds: Cultural Approaches to the City","Bridget M. Purcell","ANT 328","SA","The themes and topics of this course overlap with those in the course \"Anthropology In and Of the City \" a course offered in Spring 2013-14. For this reason  students who have taken ANT 229/ LAS 229 should not enroll in ANT 328 in Spring 2015-16..","This class explores the city and its relationship to culture through anthropology's unique methodological lens. How do ethnographers attend at once to the experiential/symbolic dimensions of urban life and the wider political/economic processes that shape the city? We will explore the politics of urban space  including how race  gender  class and religiosity are spatially produced and contested. We will also ask how contemporary economic forces are transforming cities and redrawing urban collectivities. Throughout  the city emerges as a space of contradiction: a site of pluralism & segregation  mobilities & enclosures  utopia & dystopia."
"1164","012165","Topics in Differential Equations - Local and global regularity of nonlinear evolution equations","Alexandru D. Ionescu","MAT 527","","For advanced level undergrads and graduate students..","We discuss the question of local and global existence of solutions of certain quasilinear evolution equations. These equations include plasma and water wave models. The main techniques include energy methods and semilinear harmonic analysis."
"1164","006702","Topics in Latin American Literature and Ideology - Memory and Human Rights in Latin America","Maria Gabriela Nouzeilles","SPA 345 LAS 345","LA","At least one advanced course beyond SPA 209 strongly recommended..","This course explores the role of human rights  memory  and political violence in contemporary Latin American cultural production. What does it mean to \"represent\" violence through language and images? How is truth constructed? What is the relationship between the act of witnessing and the law? Is the marketing of memory and trauma through museums and memorials weakening the political force of the collective struggles for justice and truth? These are some of the lenses through which we will read and interpret works in film  literature  art  theater  and photography from the Southern Cone  Perú  and Mexico."
"1164","012391","Topics in Low Dimensional Topology - Bordered Algebras & Knot Floer Homology","Zoltán Szabó","MAT 567","","The course assumes familiarity with basic low-dimensional topology..","Knot Floer homology is a bigraded homology theory  defined for knots in closed oriented three-dimensional manifolds. In the course  we study applications of knot Floer homology  and computational methods as well."
"1164","011180","Computational Geophysics","Dmitry Borisov Herurisa Rusmanugroho Jeroen Tromp","GEO 441 APC 441","","Courses in partial differential equations and multi-variable calculus; experience with a computer language and basic programming skills..","An introduction to weak numerical methods  in particular finite-element and spectral-element methods  used in computational geophysics. Basic surface & volume elements  representation of fields  quadrature  assembly  local versus global meshes  domain decomposition  time marching & stability  parallel implementation & message-passing  and load-balancing. In the context of parameter estimation and 'imaging'  will explore data assimilation techniques and related adjoint methods. The course offers hands-on lab experience in meshing complicated surfaces & volumes as well as numerically solving partial differential equations relevant to geophysics"
"1164","013496","The Book in East Asia: Oracle Bones to Smartphones","Brian R. Steininger","EAS 315","LA","","What were books? Amid laments for the decline of \"old media\" and the discourse of permanent revolution that surrounds digital media forms  this course reexamines the history of human interaction with the written word  focusing on East Asia in the context of world book history. Emphasizing hands-on interaction with the changing material form of texts using objects brought into the classroom and visits to Princeton collections  we analyze the interplay between technological innovation and aesthetic expression in a series of scrolls  serials  comic books  and websites from antiquity to the present."
"1164","002333","Mechanical Design","Daniel M. Nosenchuck","MAE 322","","MAE 321 or permission of instructor.","This course builds on the technical foundations established in MAE 321  and extends the scope to include a range of advanced mechanism design. Students  working in teams  will be challenged to design and fabricate a robotic system that will draw upon multidisciplinary engineering elements. The robot will be used to facilitate common daily tasks. The selected tasks vary each year. CAD  CAE  and CAM will be utilized in the design/simulation/prototype process. Labs are designed to reinforce and expand CAD and CAE skills. A final public competition will be held among the design teams. Judges from relevant industries will be present."
"1164","013561","Field Methods in Linguistics","Kyle Jerro","LIN 355","SA","","In this course  students learn both the logistical components of doing field research as well as tools for conducting effective elicitations with native speakers  including background in linguistic typology and methods for elicitation. To develop these skills  approximately half of this course will be dedicated to linguistic elicitation with a native speaker of the language chosen for the semester. This course is designed to be beneficial to students interested in pursuing both documentary/descriptive linguistic work as well as those interested in incorporating linguistic data into research in theoretical linguistics."
"1164","013543","Queer Sexualities: Biopsychosocial and LGBT Perspectives","Debbie Bazarsky","GSS 339","SA","Open to Sophomores  Juniors and Seniors Only.","Queer Sexualities is an interdisciplinary course  which intertwines the study of human sexuality from scientific and public health perspectives with queer academic writing about sexual orientation and gender. Through the lenses of human sexuality theory  social science and medical perspectives  biological and sexual functioning  and LGBT history and subcultures  this course will explore the many ways in which queer sexualities  identities  and relationships are constructed  expressed  and regulated."
"1164","008821","Introduction to Cognitive Neuroscience","Kenneth A. Norman","NEU 202 PSY 259","STL","NEU201/PSY258 or instructor's permission..","This course surveys current knowledge about the neural underpinnings of cognitive functions such as attention  language  memory  learning  and decision making. Cognitive neuroscience is a young field where many questions are yet unanswered. Through this course students will learn to extract overarching principles of cognitive function and neural organization  and to effectively address questions about the neural substrates of high-level human behaviors using current neuroscientific methods and clever experimental design. Labs will provide hands-on experience with behavioral experiments  fMRI  EEG and computational modeling."
"1164","011664","Qualitative Methods and International Relations","Keren Yarhi-Milo","POL 586","","","The seminar focuses on selected topics in international security that have not been sufficiently covered in other courses and seminars offered by the department. These include topics such as power  military effectiveness  signaling and interstate communication  beliefs and emotions  the role of reputation etc. Each session  the group will discuss the evolution in a particular body of literature in the field  while placing the emphasis on issues such as conceptualization and measurement of key variables  case selection criteria  research strategy and execution."
"1164","001390","Macroeconomics: A Mathematical Approach","Ryo Jinnai","ECO 311","SA","ECO 100 and ECO 101 and MAT 175 or MAT 201..","This course examines the determinants of long-run economic growth  short-run business cycle fluctuations  and the conduct of monetary and fiscal policy. The first part of the course develops a framework for the analysis of households' consumption and savings behavior and firms' production decisions  and uses that to analyze long-run growth and financial crises. The second part of the course extends that analysis to examine business cycle fluctuations  including inflation  unemployment. Current issues in macroeconomic and financial policy are discussed throughout."
"1164","003403","The Soviet Empire","Stephen Kotkin","HIS 362","HA","PDF option is not available to History concentrators..","An examination of the transformation of the Russian Empire into the Soviet Empire. Topics include: the invention and unfolding of single-party revolutionary politics  the expansion of the machinery of state  the onset and development of Stalin's personal despotism  the violent attempt to create a noncapitalist society  the experiences and consequences of the monumental war with Nazi Germany  and the various postwar reforms. Special attention paid to the dynamics of the new socialist society  the connection between the power of the state and everyday life  global communism  and the 1991 collapse."
"1164","013640","Natural History/History of Nature: The Concept of Nature in Classical Antiquity","Brooke A. Holmes","HUM 594 CLA 594","","","This course inquires into the natures of nature in classical antiquity via natural history  cosmology  medicine  ethics  and literature. The following topics are considered: the order and agency of the natural world in Greek literature; the relationship between physis  occult knowledge  and techniques of manifestation; human nature and the tension between physis as a force of compulsion and a norm to be fulfilled; strategies for controlling nature; the relationship between the natures of things and a single ordering Nature; competing philosophies of nature; and transcendance and immanence within philosophies of nature."
"1164","012122","Policy Research Seminar","Charles M. Cameron Miguel A. Centeno Stephen Kotkin Marlaine E. Lockheed Emily Pronin Deborah J. Yashar","WWS 404","SA","Assignment to these seminars is by a separate application process through the department..","The junior policy research seminar serves to introduce departmental majors to the tools  methods  and interpretations employed in policy research and writing. Students may choose from a range of topics."
"1164","009076","Epidemiology","Noreen Goldman","WWS 598 POP 508","","This is a required course for graduate students in the Health and Health Policy certificate program..","Course covers the basic concepts and methods of epidemiology and demonstrates how these can be applied to improve population health and reduce health inequities. Topics include: measuring the health of the population  understanding the causes of poor health  developing interventions for improving health  translating evidence into practice  and evaluating the impact of policies and programs. Key epidemiological concepts such as association  bias and confounding are covered  as well as the main epidemiological study designs."
"1164","004870","Intermediate Persian II","Amineh Mahallati","PER 107","","PER 105 or Permission Of Instructor..","The emphasis is on reading modern and classical prose  and writing modern prose. Classes are conducted mostly in Persian. Advanced grammar drills and translation exercises."
"1164","011947","Readings in Japanese Academic Style II","Keiko Ono","EAS 564","","","The second half of the two-semester course  which trains students in reading the particular style of Japanese academic writing. The second semester particularly focuses on academic writings from Meiji to the 1950s  including brief introduction of necessary Classical Japanese Grammar for this purpose. Course conducted in English."
"1164","009629","Multilevel Models (Half-Term)","Germán Rodriguez","POP 510","","POP 507/WWS 509 or equivalent.","An introduction to statistical methods for the analysis of multilevel data  such as data on children  families  and neighborhoods. Reviews fixed- and random-effects models for clustered and longitudinal data. Presents multilevel random-intercept and random-slopes models  discussing model fitting and interpretation  centering and estimation of cross-level interactions  and extensions to binary and count data using maximum likelihood and Bayesian methods. Course emphasizes practical applications using the multilevel package MLwiN. Half-term course  offered second half of spring term."
"1164","001542","Ecology and Epidemiology of Parasites and Infectious Diseases","Andrew P. Dobson Jennifer K. Peterson","EEB 328","STL","EEB 321 and enrollment in the EEB Spring semester in tropical biology taught in Panama..","An introduction to the biology of viruses  bacteria  fungi  protozoa  worms  arthropods  and parasitic plants. The major emphasis will be on the parasites of animals and plants  with further study of the epidemiology of infectious diseases in human populations. Studies of AIDS  anthrax  and worms  and their role in human history will be complemented by ecological and evolutionary studies of fig wasps  measles  myxomatosis  and communities of parasitic helminths. The course combines lectures with daily field laboratories to explore the dynamics and abundance of parasite in a variety of host species in the Panama Canal zone."
"1164","011943","Chemical Biology II","Nozomi Ando Jannette Carey Gregory D. Scholes Mohammad R. Seyedsayamdost","CHM 541 QCB 541","","","The course provides an in depth treatment of protein chemistry  natural products biosynthesis  and biophysical chemistry."
"1164","002854","Advanced French","Murielle M. Perrier ","FRE 108","","Placement through the University's Placement Test  completion of FRE 105  or permission of the Director of French Language Program..","FRE 108 is an intermediate advanced course  with a brand new syllabus. We'll take you on a journey through various periods of French history and culture and offer an opportunity to reflect on important questions at the center of controversial debates: national identity  immigration  relationships with the Francophone world and former colonies  the role of the State in the shaping of the nation  etc. We have selected a variety of authentic materials (films  videos  music  newspapers articles and literary texts) and carefully incorporated them into our curriculum so you'll develop your ability to communicate in French."
"1164","003436","Junior Seminars","Ekaterina Pravilova","HIS 400","HA","","A special section of HIS 400 for sophomores intending to major in History and who intend to spend Junior year fall term or the year abroad. Normally required of all juniors in the fall term  the seminar serves to introduce majors to the tools  methods and interpretations employed in historical research and writing. This seminar concentrates on the history of property: cultures  practices and institutions of ownership in Europe  United States and Asia  from Early Modern times to the 1990s."
"1164","013446","Recent Advances in Cosmology (Half-Term)","Paul J. Steinhardt","PHY 550","","","This half-term course focuses on problems with the current paradigms of the early universe (big bang inflation)  dark matter (weakly interacting massive particles) and dark energy (cosmological constant and analyze recent approaches for resolving the problems. The course uses published literature for the readings."
"1164","010002","An Introduction to Engineering","Jay B. Benziger Michael G. Littman Stephen A. Lyon Paul R. Prucnal","EGR 194","","","This course offers an introduction to the various disciplines of engineering. It is a project-based sequence (Energy Conversion and the Environment  Robotic Remote Sensing  and Wireless Image & Video Transmission) that covers engineering disciplines and their relationship to the principles of physics and mathematics."
"1164","003304","Intermediate Hebrew II","Maya Meshel","HEB 107","","HEB 105 or equivalent.","This course is designed for students who have completed elementary modern Hebrew language courses  and aims at further developing their reading  writing  speaking and aural comprehension skills. Emphasis will be placed on grammar and syntax  on conversational skills  and on creative writing. By the end of the spring term  students will achieve mastery of the Hebrew verb patterns  and proficiency in constructing complex sentences  and will be able to read and analyze literary works  discuss various media contents  write essays and make presentations."
