termid,courseid,title,prof_string,all_listings_string,area,prereqs,descrip
"1144","010317","Early Christian Women: From Mary Magdalene to Martyred Mothers","AnneMarie Luijendijk","REL 253 GSS 253 HLS 253","HA","","In this course we explore early Christian women as preachers  prophets  martyrs  mothers  and virgins. You will develop sophisticated reading skills by studying and interpreting a wide variety of early Christian texts and evidence from the material world (frescoes  papyrus letters). We meet  among others  Chloe  Jesus' mother Mary  Mary Magdalene  Thecla  and Perpetua and Felicitas. Questions we will investigate are: How did male Christian authors view the position of women in their communities? What can we extract historically about women? How do ancient debates relate to contemporary issues on gender and religion?"
"1144","012234","Energy Storage Systems","Daniel A. Steingart","MAE 534","","Knowledge of ODE/PDE.","This is a survey course on energy storage systems with a focus on electrochemical energy storage. Fundamentals of thermodynamics will be reviewed and fundamentals of electrochemistry introduced. These fundamentals will then be applied to devices such as batteries  flywheels and compressed air storage. Device optimization with respect to energy density  power density  cycle life and capital cost will be considered."
"1144","010377","Topics of Policy Analysis (Half-Term) - International Migration and Public Policy","Marta Tienda","WWS 594","","","This course examines the historical and contemporary literature on international migration  the policies that enable or impede cross-national migration  and the consequences for the sending and receiving states as well as the migrants themselves. Drawing on contemporary international evidence  students will consider classical and contemporary theories of immigrant adaptation  language acculturation  and ethnic conflict from comparative international evidence."
"1144","008773","Geodynamics Seminar - Origin and Evolution of the Continental Lithosphere","Blair Schoene","GEO 556","","","Despite its volumetric insignificance on Earth  the continental lithosphere is an immensely important geochemical reservoir  hosts the terrestrial biosphere  and impacts plate tectonics and therefore mantle convection. This course surveys how and why continental lithosphere is formed  preserved  and destroyed throughout Earth history. We tap into datasets collected using structural geology  geochemistry and petrology  radiogenic and stable isotopes  seismology  gravity  and heat flow  all of which are used to inform numerical and theoretical models."
"1144","001326","Classical Japanese Prose","Brian R. Steininger","EAS 541","","","Reading of prose works from pre-Meiji Japan with an emphasis on the diversity of possible modes of inscription. Other topics include genre  commentary traditions  manuscript/print cultures  and bibliography."
"1144","006269","Beginner's Russian II","Mark R. Pettus","RUS 102","","RUS 101 or permission of the instructor..","The objective of RUS 102 is to give a basic knowledge of Russian: basic training in speaking  reading  writing  and comprehending the Russian language in a cultural context."
"1144","012722","The Constitution of the Family & Individual Liberty  1867-1937","Rebecca A. Rix","HIS 571 GSS 571","","","This course explores shifts in the basis of American equality and liberty from sovereign family and corporate franchises  to individual citizenship. Interdisciplinary readings address: household government and corporate society in the nineteenth-century polity; Reconstruction's disruption of this social order and political economy; and its reconstitution by intellectuals  social networks  and constitutional amendments and laws for and against woman suffrage  labor regulation  the social welfare state  public health and education  the income tax  and Prohibition."
"1144","004908","Systematic Ethics","Gilbert H. Harman","PHI 307 CHV 311","EM","","A survey of major issues about the nature of morality. Two lectures and one precept per week."
"1144","004277","Topics in Topology - Classical high dimensional manifold theory","David Gabai","MAT 569","","","For Spring semester 2014  we plan to discuss the h-cobordism theorem and  in particular  Smale's proof of the smooth Poincare conjecture for dimensions at least 5  theory of engulfing and Stalling proof of the high dimensional piecewise linear Poincare conjecture  and the proof of the topological Schoenflies theorem after Mazur and Brown."
"1144","001400","Economics of the Labor Market","Victoria L. Prowse","ECO 331","SA","ECO 100 and ECO 302 and MAT 102 or MAT 103..","To provide a general overview of labor markets. Covering labor force participation  the allocation of time to market work  migration  labor demand  investment in human capital (education  on-the-job training  man-power training)  discrimination  unions and unemployment. The course will also examine the impact of government programs (such as unemployment insurance  minimum wages  or a negative income tax) on the labor market."
"1144","012252","Energy Storage Systems","Daniel A. Steingart","MAE 424 ENE 424","","MAE 221 or Equivalent  Freshman Physics  Freshman Chemistry  Knowlege of ODE/PDE.","This is a survey course on energy storage systems with a focus on electrochemical energy storage. Fundamentals of thermodynamics will be reviewed and fundamentals of electrochemistry introduced. These fundamentals will then be applied to devices such as batteries  flywheels and compressed air storage. Device optimization with respect to energy density  power density  cycle life and capital cost will be considered."
"1144","012640","Gardens in China and Japan","Thomas W. Hare Jerome Silbergeld","COM 317 ART 356 EAS 317","LA","","\"Gardens in China and Japan \" including a spring break class trip to Kyoto  studies gardens in a historical  religious  artistic  and literary framework so that students learn about their broad-ranging significance in traditional East Asia. In their underlying theory  siting  construction  and relations with architecture and agriculture  gardens offer rich areas for investigation and present insights about the view of nature  life of the imagination  articulation of religious and philosophical values  distribution of wealth  and human impact on the environment."
"1144","005618","Theories of Psychotherapy","James P. Hambrick","PSY 320","SA","PSY 207 or Permission of Instructor..","This course will examine the different theories  models  techniques  and settings that comprise the practice of clinical psychology in general  and psychotherapy in particular."
"1144","005858","Human Rights and Human Dignity","Stéphanie E. Hennette-Vauchez","FRS 128","EM","","See website"
"1144","012641","Greek and Roman Portraits","Michael Koortbojian","ART 411 CLA 413 HLS 413","LA","","This seminar is devoted to this history of portraiture in the Greek and Roman world. Emphasis will be given to artistic matters as opposed to issues of identity. Many of the seminar's sessions will be held in the Princeton University Art Museum  which holds a wide variety of examples. Course will also include a visit to the Metropolitan Museum of Art to study additional works."
"1144","005953","Visions of Transformation: Religious and Secular","Jeffrey L. Stout","REL 222 HUM 222 VIS 244","EC","Required for Religion Department majors..","An examination of thinkers (e.g. Pascal  Marx  Freud) and filmmakers (e.g. Hitchcock  Kurosawa  Friedrich) who distinguish between a way of life they regard as sinful  oppressive  and/or deluded and a process of change in which the alleged defects are overcome. An introduction to modern debates over religion and to film as a vehicle for social criticism."
"1144","008605","Topics in Cinema and Culture - Latin American Film - Poetics and Politics of the Third World","Javier E. Guerrero","SPA 319 LAS 325","LA","SPA 207 or higher  or instructor's permission.","An exploration of a series of critically acclaimed contemporary Latin American films  accompanied by readings that provide a theoretical and historical framework for its analysis. Topics to be discussed  among others: subalternity and the Third World; sexual and racial politics; postcolonial poetics; genocide; cultural hybridism and mestizaje; dictatorship and populism; biopolitical fantasies."
"1144","003509","Themes in World History  1300-1850","Jeremy I. Adelman","HIS 513","","","This seminar covers classical and contemporary debates and historiography of world history  from the making of world systems  to the rise and fall of empires  to global revolution and the onset of modernity."
"1144","003851","The Literature of Fact - Narrative Writing","Evan W. Thomas","JRN 440","LA","Applications at http://humanities.princeton.edu..","This is a course in the art of telling true stories. We will examine all the essential aspects of successful narrative writing: timing and pacing  character development  the sharpening of conflict and plot  the art of interviewing and reporting - how to write stories that move and are human. There will be guest speakers and weekly individual conferences to go over written work."
"1144","011035","Quantitative Analysis IV","John B. Londregan","POL 574","","","An introduction to the basic analytical and computational tools of applied Bayesian statistics. Methods covered include multi-level models  mixture modeling  Bayesian model averaging  and models for missing data and causal inference; computational tools taught include the EM algorithm and the Markov chain Monte Carlo algorithms. Goal of the course is to enable students to build and implement their own model in order to answer a particular research question. Course may be of interest to those in disciplines outside of political science who need to learn the basics of applied Bayesian statistics."
"1144","010367","U.S. Medical Research and Researchers","Adel A. Mahmoud Leon E. Rosenberg","MOL 328","STN","MOL 214/EEB 214 or MOL215/EEB215.","Medical research aims to improve and maintain human health. Accordingly  researchers employ such strategies as understanding biology  defining disease mechanisms  and developing ways to prevent  treat  or cure. Today  the U.S. is the preeminent global power in medical research through interactions among government  academia  and industry. This course will trace the evolution of this country's research enterprise  describe its diverse cultures  focus on its greatest achievements (and achievers)  and identify a number of challenges confronting it currently. How the U.S. copes with these challenges will influence the future of world health."
"1144","001147","Problems in Ancient History - The Transition from Antiquity to the Middle Ages: Numismatic Evidence","Alan M. Stahl","CLA 548 HLS 548 PAW 548","","","Coin evidence provides a unique view of the transition from the height of the Roman and Parthian Empires in the first centuries CE through the development of distinctly Latin  Byzantine  and Islamic zones by the end of the eighth century. Attention is given to cases where the numismatic evidence of change and identity varies from that supplied by written  archaeological  and other visual sources. The coin finds from Princeton's Antioch excavations supply a test case for this transition and a point of comparison for other sites. No previous numismatic training is expected."
"1144","012317","The History of Russian Rock","Mark R. Pettus","RUS 409","","RUS105 or instructor's permission..","The course will examine cultural discourse in the late Soviet and post-Soviet periods through the lens of Russian rock lyrics  paying particular attention to musicians' divergent responses to authoritative Soviet discourse  and strategies for renewing language and recapturing meaning amidst that discourse's collapse. A variety of musical genres will be explored  from official Soviet music  to the \"bards\" and blatnaya pesnya  to the emergence of rock and punk music and its enduring importance in giving voice to political protest."
"1144","012569","Communities and Natural Ecosystems (Half-Term)","William Kornblum","SOC 584","","","This course presents an overview of ecological theory and research in the social sciences with emphasis on the interactions among communities and ecosystems. Each of the six class sessions is devoted to consideration of a body of representative literature from ecology and environmental sociology."
"1144","010279","Interacting with Data","David M. Blei Xiaoyan Li","COS 424","","MAT 202 and COS 126 or equivalent or permission of instructor..","Computers have made it possible  even easy  to collect vast amounts of data from a wide variety of sources. It is not always clear  however  how to use that data  and how to extract useful information from it. This problem is faced in a tremendous range of business and scientific applications. This course will focus on some of the most useful approaches to this broad problem  exploring both theoretical foundations and practical applications. Students will gain experience analyzing several kinds of data  including text  images and biological data. Topics will include classification  clustering  prediction  and dimensionality reduction."
"1144","007217","Introductory Drawing","Daniel A. Heyman Kurt Kauper","VIS 202 ARC 202","LA","","This course approaches drawing as a way of thinking and seeing. Students will be introduced to a range of drawing issues  as well as a variety of media  including charcoal  graphite  ink  oil stick  collage  string  wire and clay. Subject matter includes still life  the figure  landscape and architecture. Representation  abstraction and working from imagination will be explored. A structured independent project will be completed at the end of the term."
"1144","012309","Analysis of Big Data","Han Liu","ORF 350","QR","ORF 245.","The amount of data in our world has been exploding  and analyzing large data sets is becoming a central problem in our society. This course introduces the statistical principles and computational tools for analyzing big data: the process of exploring and predicting large datasets to find hidden patterns and gain deeper understanding  and of communicating the obtained results for maximal impact. Topics include massively parallel data management and data processing  model selection and regularization  statistical modeling and inference  scalable computational algorithms  descriptive and predictive analysis  and exploratory analysis."
"1144","002859","Studies in French Language and Style","Natasha C. Lee ","FRE 207","","FRE 107  FRE 108  or placement based on placement test..","A study of French contemporary culture and society. Intensive oral and written study of vocabulary  grammar  and idiomatic expressions prepares students for advanced courses in French literature and civilization and for working programs in French-speaking countries. Small class format. Strong emphasis on discussion. Film series. Intensive practical training in oral and written French."
"1144","005558","Introduction to Psychology","Elizabeth Gould","PSY 101","STL","","The study of human nature from the viewpoint of psychological science. Topics range from the biological bases of human perception  thought and action to the social-psychological determinants of individual and group behavior. This course is a prerequisite for majoring in psychology and can also be used to satisfy the science and technology with laboratory general education requirement."
"1144","008755","A Nation of Immigrants","Maria A. Medvedeva","WRI 160","","","See the Princeton Writing Program website."
"1144","001068","Intermediate Chinese II","Jianfei Chen Yongtao Zhang Yunjun Zhou Xin Zou","CHI 107","","CHI 105 or instructor's permission..","Continuing the intensive study of modern spoken and written Chinese  this course shifts the emphasis to the reading of modern cultural and social issues."
"1144","008037","Modern Japanese Literature: Early Years","Atsuko Ueda","EAS 343","LA","","This course introduces modern Japanese fiction by focusing on the production of the \"modern body.\" We will examine the ways in which discoveries of new sexuality  the new male/female subjects  are inextricably linked to the nationalization process in Japan."
"1144","001380","Introduction to Macroeconomics","Alan S. Blinder","ECO 101","SA","ECO 101 is offered both terms and may be taken before or after (or simultaneously with) ECO 100..","Analysis of the operation of the national economy  with emphasis on the causes and consequences of recessions and booms  inflation and unemployment--and possible policy responses to each. Attention is also paid to the banking and financial systems  the financial crisis  and international influences on the U.S. economy."
"1144","002861","France Today: Culture  Politics  and Society","Christine M. Sagnier","FRE 215","","FRE 108 or equivalent; FRE 207 recommended..","This course is designed to develop students' linguistic skills and broaden their knowledge of contemporary French society. Discussions and essays will cover a wide range of topics drawn from economic  political  social and cultural aspects of France and the francophone world. Current affairs will be discussed in class on a regular basis. The course will provide intensive language practice and students will improve their communication skills by completing a research project  to be presented orally and in writing  on a topic of their choice. Course material include readings  videos  films  francophone television and web-based activities."
"1144","001569","Colloquium on the Biology of Populations","Lars O. Hedin Simon A. Levin","EEB 522","","","Discussion of the central problems of population biology and approaches that have proved fruitful. Topics ranging throughout ecology  evolution  biogeography  and population genetics are usually related to presentations by visiting speakers and students. (This is a core course.)"
"1144","007973","Directed Research","Peter R. Jaffé","CEE 509","","","Under the direction of a faculty member  each student carries out research and presents the results. Directed research is normally taken during the first year of study. The total grading of the course will be 25% poster presentation and 75% submitted work."
"1144","002913","Seminar in Medieval French Literature - Living Texts  Live Performances","Jeanette L. Patterson","FRE 510 MED 510","","","We often treat medieval texts as dead artifacts by dead authors in a dead language  preserved in \"best-text\" print editions. This course aims to recover medieval experiences and practices of literature that depended on the living bodies that read  recited  performed  recopied and repurposed it. With attention to the fluidity of the French vernacular and the mediated nature of its early literature  this course covers a range of medieval texts and critical-theoretical approaches to their study  while also giving students hands-on experience with manuscripts and basic reading knowledge of Old/Middle French."
"1144","012566","Comparative Ethnicity  Nationalism  and Race I (Half-Term)","Andreas Wimmer","SOC 572","","","The course is based on the assumption that ethnicity  race  and nation belong to a broad family of forms of cultural understanding  social organization  and political contestation  all related to perceived similarities and differences of cultural background  social belonging  and political destiny. We devote a week to each of five broad theoretical and empirical approaches  emphasizing (1) political modernization and state-building; (2) economic competition and uneven development; (3) the construction of boundaries  categories  and identities; (4) rational choice and micro-mechanisms; (5) sociobiological or psychological roots."
"1144","006681","Advanced Spanish Language and Style","Alberto Bruzos Moro Dunia Catalina Méndez Vallejo","SPA 307","LA","SPA 207 or 209; or another 200-level Spanish course with instructor's permission. Students who have completed their Spanish language requirement through the Department's placement test or an AP 5/SP SAT ST 760 score can take the course only with instructor's permission..","An advanced language course. Its main purpose is to develop and reinforce accuracy and fluency in both writing and speaking Spanish. Students will also learn to identify linguistic features that characterize different genres as well as social and cultural factors that aid in the interpretation and understanding of different texts and types of speech."
"1144","002553","Selected Topics in Solid-State Electronics - Contemporary Challenges in Electric Power","Jay B. Benziger Yiguang Ju Warren B. Powell Daniel A. Steingart Sigurd Wagner","ELE 547 EGR 547","","","The goal of this readings-and-presentations course is to introduce students to recent and anticipated technical developments in the electric power industry. Increasing electrification of advanced economies  network coordination over ever larger geographic areas  power generation by distributed wind and photovoltaics  lack of broadly usable electricity storage  and electrification of automotive transportation are posing many new challenges to the generation  transmission  distribution  and use of electric power. Lecturers and students present specific topics. Students choose topics on their own or from the syllabus."
"1144","001045","Metals in Biology","Dorothea Fiedler John T. Groves","CHM 544 ENV 544","","Prerequisites: CHM 301/302 or CHM 303/304.","Life processes depend on over 25 elements whose bioinorganic chemistry is relevant to the environment (biogeochemical cycles)  agriculture  and health. CHM 544 surveys the bioinorganic chemistry of the elements. In-depth coverage of key transition metal ions including manganese  iron  copper  and molybdenum focuses on redox roles in anaerobic and aerobic systems and metalloenzymes that activate small molecules and ions  including hydrogen  nitrogen  nitrate  nitric oxide  oxygen  superoxide  and hydrogen peroxide. Appreciation of the structure and reactivity of metalloenzyme systems is critical to understanding life at the molecular level."
"1144","010970","Introduction to Interdisciplinary Theater","Rinde W. Eckert","THR 302","LA","Open to actors  dancers  composers  musicians  designers  directors  writers  and visual artists who are interested in working across their usual disciplinary borders..","Practicing thinking like a writer-who-thinks-like-an-actor-thinking-like-a-dancer-who-thinks-like-a-musician-thinking-like-a-painter-who-thinks-like-a-composer-who-directs. Exploring theater from all angles (words  music  movement  sculpture  design)  we will be building an understanding of multi-dimensional theatrical logic over the course of the semester. We will explore  provoke  invent  and analyze the phenomenal  the poetic  the sententious  the informative  the confrontational  and the entertaining."
"1144","012181","Biology of African Animals and Ecosystems","Dustin R. Rubenstein","EEB 406","","EEB 211 and EEB 321. Open to students enrolled in the field semester in Kenya..","Students will be immersed in an intensive field experience in Kenya gaining sophisticated training in fieldwork and biological research on African animals and ecosystems. In addition to this training  participants will observe and study organisms ranging from acacia ants to giraffes  go-away-birds to zebras. The course is designed to give students a broad  hands-on understanding of ecology  evolution  and conservation. Lectures include core topics in ecology and evolution. Students will gain experience with experimental design  data collection  and analysis. Limited to students in the Tropical Biology and Sustainability Program in Kenya."
"1144","007992","Special Topics in Environmental Engineering and Water Resources - Geochemistry","Peter R. Jaffé","CEE 599","","","Studies in selected areas of geochemistry and biogeochemistry. Special topics vary according to the instructor's and the students' interests."
"1144","005277","Political Theory","Alan Ryan","POL 210","EM","This course is open to first year students..","The course explores ideas about justice  authority  freedom  and revolution in the work of classical and modern authors from Plato to Marx. It will be both thematic and historical in nature - and introductory."
"1144","002732","Literary and Cultural Theory - Performance and Performativity","Alexandra T. Vazquez","ENG 571","","","This course investigates \"performance\" and \"performativity\" as both curricular objects and modes of inquiry. As the field of performance studies begins to take root in many contemporary locations  the seminar re-ignites a spirit of radicality to theories of performativity and engage critical and creative works that challenge the field's dominant paradigms of embodiment  liveness  and official theatrical stages. Through close attention to critical experiments in sound  visual arts  and literature  the seminar explores how performance and performativity enliven scholarly methodologies and aesthetic forms."
"1144","012573","The Emergence of the Modern Middle East: Arabic Sources","Cyrus Schayegh","NES 524","","","The end of the Ottoman Empire ushered in a key transitional period in Middle East history. This seminar uses Arabic monographs  memoirs  newspapers and novels to study life in Syria  Lebanon  Palestine  and Jordan from the end of the Ottoman era to early independence  and to practice formulating textually based research questions. Throughout paying attention to underlying questions of gender  culture  and space  the class focuses on the transition from the Empire  ideologies  the position of women  generational and social class changes  and political issues from the 1930s to the 1940s  including the Palestine Question."
