termid,courseid,title,prof_string,all_listings_string,area,prereqs,descrip
"1144","011595","Intermediate Polish","Irena G. Gross","PLS 107","","PLS105.","The class will continue to improve students' knowledge of Polish through conversation and review of grammar  and it will enhance their reading skills through the analysis and translation of some Polish poetry and fragments of prose. There will be also short written assignments."
"1144","010276","Engineering Projects in Community Service (EPICS): Non-credit","Jay B. Benziger Elie R. Bou-Zeid Michael G. Littman","EGR 350","","Juniors only (except for sophomores who have completed EGR 251)..","In the Engineering Projects in Community Service (EPICS) program  students earn academic credit for their participation in multidisciplinary design teams that solve technology-based problems for local not-for-profit organizations. The teams are: multidisciplinary--drawing students from across engineering and around the university; vertically-integrated--maintaining a mix of sophomores through seniors each semester; and long-term--each student may participate in a project for up to six semesters. The continuity  technical depth  and disciplinary breadth of these teams enable delivery of projects of significant benefit to the community."
"1144","012662","Religious Conversion","Leora F. Batnitzky","REL 369","EM","","In the United States  we often think of religious conversion as a radical change in belief on the part of the individual. But historically  and still in much of the world today  religious conversion is as much political as theological. This seminar focuses on religious conversion from the perspectives of politics  international law and human rights  history  literature  post-colonialism  race  psychology  anthropology  and religious studies. Our aim is to understand the complexity of thinking about religious conversion as well as the very category of \"religion.\""
"1144","009655","Contemporary Feminist Theory","Gayle Salamon","GSS 400","SA","GSS 201 or equivalent..","We will take as our primary text the new translation of Simone deBeauvoir's landmark volume The Second Sex  one of the most significant origin points of current understandings of gender. In our sustained consideration of The Second Sex  we will explore Beauvoir's ideas about the influence of sex and gender on childhood  the family  sexuality  relationships  aging  work  the social order  and the philosophical imaginary. We will also consider contemporary fiction and film alongside that text  taking Beauvoir as our tour guide as we encounter and interpret contemporary representations of gender."
"1144","002652","Literature of the American Renaissance  1820-1860","Lee C. Mitchell","ENG 350","LA","","Close study of nine authors--the so-called literary \"renaissance\" of the new republic--who defined a native brand of literature that would influence all subsequent American writers. Our focus will be on narrative and poetic forms that signaled independence from older ideals  offering an exhilarating yet deeply unsettling transition in literary history."
"1144","002536","Theory of Detection and Estimation","Sergio Verdú","ELE 530","","","An introduction to the fundamental theoretical principles of signal processing related to detection and estimation. The level of this course is suitable for research students in communications  control  signal processing  and related areas."
"1144","001472","Research Methods in Demography","Tod G. Hamilton","POP 502 ECO 572 SOC 532","","POP 501/ECO 571/SOC 531 or instructor's permission..","Source materials used in the study of population; standard procedures for the measurement of fertility  mortality  natural increase  migration  and nuptiality; and uses of model life tables and stable population analysis and other techniques of estimation when faced with inaccurate or incomplete data are studied."
"1144","002441","Combustion","Chung K. Law","MAE 531 ENE 531","","","Chemical thermodynamics and kinetics  oxidation of hydrogen  hydrocarbons and alternate fuels  pollutant chemistry and control  transport phenomena  laminar premixed and nonpremixed flames  turbulent flames  ignition  extinction  and flammability phenomena  flame stabilization and blowoff  detonation and blast waves  droplet  spray and coal particle combustion  principles of engine operation."
"1144","012721","Topics in Geometric Analysis and General Relativity - Advanced Topics in General Relativity","Mihalis Dafermos","MAT 526","","Undergrads must obtain permission of instructor..","This course will cover a selection of advanced topics in General Relativity  which could include the construction of dynamical black hole spacetimes  the formation of weak null singularities for the vacuum  and the stability of the Schwarzschild black hole."
"1144","009587","Between Resistance and Collaboration: The Second World War in Europe","Jan T. Gross","HIS 341","HA","PDF option not available to History concentrators..","In the broader context of conflict between fascism  communism  and liberal democracy  we shall examine various patterns and methods of occupation  collaboration  and resistance during World War II in Western and Eastern Europe. The Holocaust of European Jewry and the technology of terror will be discussed. We will try to ascertain how elites and different social strata were affected by the impact of war and occupation. Students will be asked to read historical studies as well as personal narratives by eyewitnesses and participants."
"1144","012612","Founders: The Early American Republic in American History","James A. Dun","HIS 441","HA","Preference given to students who have taken History 372 and/or History 373..","This seminar offers students the opportunity to dig into readings treating American history during the early national period  roughly 1783-1820  when the ideals of the Revolution met the realities of statecraft  when the social institutions of British America were strained through a new national idiom  and when many important issues that would prove vital to subsequent American history were first raised. We will read and talk about Washington  Jefferson  and the like  but also people and groups who are less familiar. An excellent course for those contemplating independent work in this period."
"1144","005125","Introductory Physics II","Steven S. Gubser Norman C. Jarosik","PHY 102","STL","PHY 101.","This course presents an introduction to the fundamental laws of nature  especially optics  electricity/magnetism  nuclear and atomic theory. These are treated quantitatively with an emphasis on problem solving. The laboratory is intended to give students an opportunity to observe physical phenomena and to gain \"hands-on\" experience with apparatus and instruments."
"1144","007263","Advanced Video and Film Production","Su Friedrich","VIS 462","LA","VIS 261/262  VIS 263/264 and self-sufficiency in film editing software such as Premiere or Final Cut Pro..","This course builds on a student's prior experience in writing  shooting and editing. Work develops from their ideas; a student can make one term-long project or numerous short ones  and in any genre. The idea is to refine one's technical skills and expand one's approach to storytelling."
"1144","009644","Topics in Mathematical Modeling - Mathematical Neuroscience","Philip J. Holmes","MAT 323 APC 323","QR","This interdisciplinary course in collaboration with Molecular Biology  Psychology and the Program in Neuroscience is directed toward upper class undergraduate students and first-year graduate students with knowledge of linear algebra and differential equations..","Draws problems from the sciences & engineering for which mathematical models have been developed and analyzed to describe  understand and predict natural and man-made phenomena. Emphasizes model building strategies  analytical and computational methods  and how scientific problems motivate new mathematics."
"1144","006276","Advanced Russian Reading and Conversation II","Ksana Blank","RUS 208","","RUS 207 or permission of instructor..","A continuation of 207. Translation and discussion of the literary texts (20th-century poetry) and the poets' biographies; review of selected grammar topics; work with two movies."
"1144","012680","Street Politics: Revolutions and Social Movements in the Middle East","Kevan K. Harris","NES 366 SOC 366","SA","","Revolutions and social movements are at the center of contemporary politics in Western Asia and Northern Africa. Of course  most of them have not produced outcomes the protagonists intended. Yet the old Middle East order is likely kaput. Why did it happen  what are the variations  and how is it playing out today? This seminar explores the recent wave of Middle East social protest through the historical sociology of revolutions  states  and social movements. The 20th century produced plenty of all three as well as theories about why they intertwine. By paying attention to them  we can learn to think as revolutionaries and tyrants alike."
"1144","011125","The Physical Basis of Human Disease","Celeste M. Nelson","CBE 440","","","This course covers major diseases (cancer  diabetes  heart disease  infectious diseases)  the physical changes that inflict morbidity and mortality  the design constraints for treatment  and emerging technologies that take into account these physical hurdles. Taking the perspective of the design constraints on the system (that is  the mass transport and biophysical limitations of the human body)  we will survey recent results from the fields of drug delivery  gene therapy  tissue engineering  and nanotechnology."
"1144","005438","Formal Political Analysis I","Kristopher W. Ramsay","POL 575","","","A rigorous introduction to choice theory  social choice theory  and non-cooperative game theory. The course serves as the first formal theory graduate course and draws on mathematics at the level of POL 502."
"1144","012303","Intensive Korean II","Ho Jung Choi","KOR 108","","KOR 103 and KOR 108 are designed as a year-long sequence. Credit for KOR 103 will not be given unless it is followed by KOR 108. Students who have completed both courses will be considered to have fulfilled the language requirement equivalent to completing two-year study of a foreign language..","A continuation of Korean 103. This course covers the 2nd Year Korean material focusing on complex grammatical structures  reading  and writing. Journals are kept for writing practice. The students who have successfully completed KOR 103 and KOR 108 will be placed in the 3rd or 4th year Korean if they wish to continue."
"1144","001405","Environmental Economics","Smita B. Brunnermeier","WWS 306 ECO 329 ENV 319","SA","MAT 103 or equivalent and ECO 300 OR equivalent..","Course introduces use of economics in understanding both the sources of and the remedies to environmental and resource allocation problems. It emphasizes the reoccurrence of economic phenomena like public goods  externalities  market failure and imperfect information. Students learn about the design and evaluation of environmental policy instruments  the political economy of environmental policy  and the valuation of environmental and natural resource services. The concepts are illustrated in a variety of applications from domestic pollution of air  water and land to international issues such as global warming and sustainable development."
"1144","008857","International Trade II","Eduardo Morales Esteban A. Rossi-Hansberg","ECO 552","","","A continuation of ECO 551  with emphasis on current research issues. Topics vary from year to year."
"1144","006673","Hispanic Studies: Introduction to Cultural Analysis","Manuel-Angel G. Loureiro","SPA 224","LA","Another SPA 200-level course or instructor's permission.","An introduction to the analysis of contemporary cultural texts (narrative  poetry  film  photography) from Latin America and Spain  with the support of various theoretical ideas. The course's main objective is to provide students with a set of strong conceptual  analytical and linguistic skills  which will be of great help in 300-level literature/culture courses."
"1144","011575","Seminar in Global Health and Health Policy","Bryan T. Grenfell Adel A. Mahmoud Thomas E. Shenk","GHP 400 WWS 382 MOL 499 EEB 400","","GHP 350 or permission of instructor.","This seminar will examine three major topics in global health. Potential topics include: the importance of patents in healthcare; AIDS in America; synthetic biology and biosafety; vaccine safety; the business of biology; the state of US healthcare; healthcare in emerging economies; and drug discovery and development."
"1144","012350","Topics in Automorphic Forms - Moduli Spaces of Vector Bundles","Sophie M. Morel","MAT 518","","Undergraduates must obtain permission of instructor..","The goal of this course is to explain the proof V. Lafforgue's recent results on the global Langlands correspondence for reductive groups over functions fields. I also review some background material such as the affine Grassmannian  the geometric Satake correspondence and moduli spaces of G-bundles  G-bundles with modifications and G-shtukas. I assume that the audience is familiar with the material in Hartshorne's \"Algebraic geometry\" and Milne's \"Etale cohomology\"."
"1144","010707","The Dreamkeepers: Education Reform and the Urban Teaching Experience","Kathleen M. Nolan","FRS 170","SA","","See website"
"1144","001461","Industrial Organization and Public Policy II","Jan K. De Loecker Eduardo Morales","ECO 542","","","Theoretical and empirical study of the public regulation and deregulation of rate of return  prices  and entry in public utilities and franchise oligopolies. Theory and practice of antitrust policy is examined  including some elements of antitrust law. In addition  regulation of product quality  advertising  and safety is examined. This course draws heavily on material developed in 541."
"1144","005131","Advanced Physics (Electromagnetism)","M. Zahid Hasan William C. Jones","PHY 106","STL","PHY 103 or PHY 105..","This course features the classical theory of electricity and magnetism  with emphasis on the unification of these forces through the special theory of relativity. While the subject matter is similar to that of PHY 104  the treatment is more sophisticated. The topics also include DC and AC circuits and the electromagnetic behavior of matter."
"1144","006291","The Great Russian Novel and Beyond: Dostoevsky  Tolstoy  Chekhov  and Others","Ellen B. Chances","SLA 220 RES 220","LA","Curiosity. Knowledge of Russian not required. Open to first-year students as well as to sophomores  juniors  and seniors in any department..","An examination of significant trends in Russian literature from the 2nd half of the 19th century to the Russian Revolution and a bit beyond. The course focuses on many masterpieces of 19th & 20th-century Russian literature. The works (mostly novels) are considered from a stylistic point of view and in the context of Russian historical and cultural developments. The course also focuses on questions of values and on the eternal \"big questions\" of life that are raised in the literature. Authors read include Turgenev  Dostoevsky  Tolstoy  Chekhov  Bely  Nabokov  and Kharms."
"1144","009990","Ecology and Conservation of African Landscapes","Paula G. Kahumbu Robert M. Pringle","EEB 380","STL","Open to students enrolled in the field semester in Kenya.","Only six percent of Africa's land area (containing a fraction of its biodiversity) is protected  and these areas are rarely large enough to sustain wildlife populations. Mostly  wildlife must share land with people also facing survival challenges. This course will explore how wildlife and people interact in Kenya  where new approaches to conservation are being developed. Lectures will cover the ecology of tropical grasslands and first principles underlying conservation and management of these landscapes. Field trips and projects will examine the dynamics between human actions and biodiversity conservation."
"1144","008353","Neuroscience of Being Human  The","Joseph R. Califf","WRI 143","","","See the Princeton Writing Program website."
"1144","005976","Religion in American Society","Judith Weisenfeld","REL 258","SA","","This course explores the dynamics of religion in contemporary America. We consider such themes as religious encounter and conflict; patterns of tradition and change; the relation of religion to broader political currents and debates (including race  sexuality  gender  science  economics); \"secular\" spiritualties  the challenges of religious pluralism; and religion and popular culture."
"1144","012702","Fundamentals of Nanophotonics","Alejandro W. Rodriguez","ELE 561 PHY 565","","Knowledge of basic linear algebra and differential equations at the undergraduate level is assumed. Prior knowledge of quantum mechanics is not required  but helpful..","Introduction to theoretical techniques for understanding and modeling nanophotonic systems  emphasizing important algebraic properties of Maxwell's equations. Topics covered include Hermitian eigensystems  photonic crystals  Bloch's theorem  symmetry  band gaps  omnidirectional reflection  localization and mode confinement of guided and leaky modes. Techniques covered include Green's functions  density of states  numerical eigensolvers  finite-difference and boundary-element methods  coupled-mode theory  scattering formalism  and perturbation theory. The course explores application of these techniques to current research problems."
"1144","005917","Monstrosity in Film and Literature","Andrew Cole","FRS 160","LA","","See website"
"1144","012744","Embodied Computation","Axel Kilian","ARC 596","","The emphasis is on learning new methods of developing design  and there are no prerequisites  but a strong motivation to tackle new knowledge and work in an experimental design setting is expected.","Computational design is often presented as a problem solving tool for design implementation rather than as an integral part of design conceptualization and exploration. This seminar focuses on approaching computational design from the conceptual design direction extending existing or defining novel models of design along the way. A strong emphasis is put on prototyping as a mode of design iteration using both computational prototypes and computationally generated physical prototypes as embodiments of the design process."
"1144","001480","Research Program in Development Studies","Angus S. Deaton","ECO 581","","","Drafts of papers  articles  and chapters of dissertations or books  prepared by graduate students  faculty members  or visiting scholars  are exposed to critical analysis by a series of seminars organized by field. The chief objectives are for the writers to receive the benefit of critical suggestions  for all participants to gain experience in criticism and uninhibited oral discussion  and for students and faculty members to become acquainted with the research work going on in the department. Third- and fourth-year graduate students are expected to attend; first-and second-year students and faculty members are invited to attend."
"1144","010721","Fundamentals of Queueing Theory","William A. Massey","ORF 407","QR","ORF 309.","An introduction to the fundamental results of queueing theory. Topics covered include the classical traffic  offered load  loss and delay stochastic models for communication systems. Through concrete examples and motivations we discuss the theory of Markov chains  Poisson processes and Monte-Carlo simulation. Fundamental queueing results such as the Erlang blocking and delay formulae  Little's law and Lindley's equation are presented. Applications are drawn from communication network systems  inventory management  and optimal staffing."
"1144","012644","Self-Love and the Common Good: from Aristotle to the Invisible Hand","Christophe Frédéric Laurent Litwin","ECS 324 COM 302 FRE 324","SA","","Aristotle opposed self-love to selfishness and regarded the former as the natural reward of virtue. In the Christian tradition  however  self-love is the sinful passion that caused man's fall. Outside of charity  human virtues are but disguised selfishness. Yet  does it matter so much that our private actions be selfish if they benefit society? Early-modern philosophers became increasingly interested in questioning the controversial paradox that encouraging men to be selfish might result in better government than educating them to be virtuous. We will discuss those debates and their role in early-modern moral  political and economic theories."
"1144","012060","Mathematics for Economics/Life Sciences","Jennifer M. Johnson Hanne Vlaeminck","MAT 175","QR","MAT103 or equivalent..","Survey of topics in calculus and linear algebra as preparation for future course work in economics or life sciences. Topics include basic techniques of integration  average value  improper integrals and rates of growth  partial derivatives  gradient  Lagrange multipliers  linear systems  determinants  matrix inversion  eigenvalues and eigenvectors  as time permits."
"1144","006515","Religion and Public Life","Robert J. Wuthnow","SOC 527","","","Presentation and critical discussion of empirical research in progress by participants. Focuses on the use of social science methods in the study of religion and on applications of recently published work about religion and society. Includes an emphasis on religion and public policy in the U. S. and in comparative perspective."
"1144","012120","Science and Global Security: From Nuclear Weapons to Cyberwarfare","Alexander Glaser","WWS 353 MAE 353","STN","","This course will provide students with a basic technical understanding of some of the critical technologies that are relevant to national and global security and will equip students with the skills to better assess the challenge of developing effective policies to manage such technologies. Case studies will inter alia include nuclear weapons and their proliferation  nuclear and radiological terrorism  space weapons  biosecurity and cyberware."
"1144","007243","Introductory Video and Film Production","Keith J. Sanborn","VIS 262","LA","This course is now open enrollment ..","A film can be fictional or documentary  but there are also many other ways to tell a story. Through hands-on studio work  screenings  critical readings and group critiques  this course teaches the basic tools and approaches for film production with digital media including writing  camerawork  sound  editing  and postproduction. Technical instruction paired with conceptual frameworks will give you the means to find your visual storytelling voice and your filmmaker's point of view."
"1144","006218","Seminar in Romance Linguistics and/or Literary Theory - Levinas and Blanchot","Thomas A. Trezise","FRE 583","","","A seminar on the work of Emmanuel Levinas and Maurice Blanchot  following the development  from a common origin in German phenomenology  of the ethics and the aethetics for which they are respectively well known."
"1144","006917","Economic Analysis of Development (Advanced)","Anne C. Case","WWS 562","","WWS 507C & 511C.","Considers theories and evidence to explain processes of economic development; examines theories of economic growth  and the two-way links between development and poverty  inequality  social institutions  and the family. Policy debates on education  health  and social policy  and governmental and international aid are also covered."
"1144","012660","Neuroeconomics","Yael Niv","NEU 425 PSY 425","","Students may come from different backgrounds  so we will not assume knowledge in economics  or a biological or psychological background. We will assume basic quantitative background (e.g.  introductory statistics)  and knowledge in either neuroscience or economics. Prerequisites: one of NEU/PSY259 (Cognitive Neuroscience)  ECO310 (Microeconomic Theory) or ECO317 (Economics of Uncertainty) as well as one of PSY251/MOL355 (Quantitative Methods) or ECO202 (Statistics and Data Analysis) or equivalent..","This seminar focuses on the recent explosion of interest in understanding the neural basis of valuation and decision making  and the resulting marriage between the formal rigor of economics and the empirical basis of psychology and neuroscience  termed \"neuroeconomics\". We will approach the question of how the brain makes economic decisions from multiple perspectives  drawing on theoretical  behavioral  and neural data from economics  psychology  and neurobiology. Major topics include: decision under risk and uncertainty; the role of learning in evaluating options; choice mechanisms; and multiplayer interactions and social decision making."
"1144","004455","Computer and Electronic Music Composition","Jeffrey O. Snyder","MUS 316","LA","MUS/COS 314 or Permission of the Instructor.","A composition workshop class  with a focus on synthesis techniques. Emphasis will be on the students creative work  composing both \"fixed media\" works  and live electronic/laptop music."
"1144","007989","Physical Hydrology","Eric F. Wood","CEE 586","","","The course develops model parameterization for land surface water and energy models based on the underlying physics and mechanisms of surface and subsurface runoff generation  evapotranspiration  infiltration  and snow accumulation and melt. A goal of the course will be the development of a land surface model. Numerical issues related to land surface modeling will be discussed."
