termid,courseid,title,prof_string,all_listings_string,area,prereqs,descrip
"1144","004879","Elementary Korean II","Joowon Suh","KOR 102","","KOR 101 or Instructor's permission..","A continuation of KOR 101. Continued development of proficiency in basic communication."
"1144","008003","Independent Research Project","Alain L. Kornhauser","ORF 376","","Students MUST sign up in room 121 during course selection period..","Independent research or investigation resulting in a report in the student's area of interest under the supervision of a faculty member. Open to sophomores and juniors."
"1144","001225","Advanced Creative Writing (Fiction)","Jeffrey K. Eugenides Patrick J. McGrath Claire V. Watkins Colson Whitehead","CWR 304","LA","Admission by application only and must have completed two 200-level fiction courses. Please visit the Creative Writing Program website for application information..","Advanced practice in the original composition of fiction for discussion in regularly scheduled workshop meetings. The curriculum allows the student to develop writing skills  provides an introduction to the possibilities of contemporary literature and offers perspective on the place of literature among the liberal arts. Criticism by practicing writers and talented peers encourages the student's growth as both creator and reader of literature."
"1144","004918","Philosophy of Language","Delia G. Fara","PHI 317","EC","Course open to freshmen..","An introduction to selected topics in the philosophy of language  including the semantics of names  formal semantics  conditionals  necessity and possibility  and pragmatics."
"1144","005814","Art and Science of Motorcycle Design","Michael G. Littman","FRS 106","STL","","See website"
"1144","008338","Witnessing Disaster","Timothy Recuber","WRI 128","","","See the Princeton Writing Program website."
"1144","008006","Operations and Information Engineering","Warren B. Powell Hugo Passos Simão","ORF 411","","ORF 245/ECO 300  ORF 307/MAT 305  ORF 309.","The management of complex systems through the control of physical  financial and informational resources. The course focuses on developing mathematical models for resource allocation  with an emphasis on capturing the role of information in decisions. The course seeks to integrate skills in statistics  stochastics and optimization using applications drawn from problems in dynamic resource management which tests modeling skills and teamwork."
"1144","005100","Elementary Modern Greek II","Kathryn Stergiopoulos","HLS 102 MOG 102","","HLS 101 or equivalent  or permission of instructor..","To provide the basis for acquiring a command of written and spoken Modern Greek."
"1144","012594","Ghosts  Vampires  and Zombies in Irish Theatre and Literature","Fintan O'Toole","THR 384 ENG 387","LA","","From the spirits and banshees of oral legends to Bram Stoker's Dracula  from the classic works of Yeats  Synge and Beckett to Garth Ennis's Preacher comics and Anne Rice's Vampire novels  Irish culture has been haunted by the Otherworld. Why has the Irish Gothic had such a long ghostly afterlife on page and stage? Can we learn something about modernist works like those of Yeats and Beckett by seeing them through the perspective of popular fictions of the supernatural?"
"1144","001322","Readings in Chinese Literature - The Discourse of Nature","Ping Wang","EAS 534","","","The discourse of nature constitutes an appealing aspect of Chinese poetry. However  questions such as how nature is defined and depicted  whose nature poets concern themselves with  and to what extent the discourse comes to be shaped by a literary trend remain unanswered. This course is designed to treat these questions in the broad historical and political context of the Disunion Period  i.e.  third through sixth centuries  by delving into critical as well as poetic writings in the primary language. Traditional narratives on the representation of nature and the evolution of nature poetry are also examined."
"1144","010376","Topics of Policy Analysis (Half-Term) - Climate Change: Science and Policy","Denise L. Mauzerall","WWS 594","","","Designed to improve students' skill  confidence and judgment in use of science in policy applications. Using case studies  real-world examples  and in-class exercises  in the areas of atmospheric and energy policy  the emphasis is on preparing both non-scientists and scientists to use  understand  and critique science in environmental policy applications. Exercises are scaled to the student's background."
"1144","008485","The American Dance Experience and Africanist Dance Practices","Dyane Harvey Salaam","DAN 211 AAS 211","LA","Some form of social dancing  good  natural movement aptitude  or former dance training. This is an OPEN ENROLLMENT course..","A studio course introducing students to American dance aesthetics and practices  with a focus on how its evolution has been influenced by African American choreographers and dancers. An ongoing study of movement practices from traditional African dances and those of the African diaspora  touching on American jazz dance  modern dance  and American ballet. Studio work will be complemented by readings  video viewings  guest speakers  and dance studies."
"1144","002096","Theoretical Machine Learning","Robert E. Schapire","COS 511","","","Introduction to theoretical machine learning  including mathematical models of machine learning  and the design and rigorous analysis of learning algorithms. Likely topics include: bounds on the number of random examples needed to learn; learning from non-random examples in the on-line learning model; how to boost the accuracy of a weak learning algorithm; support-vector machines; maximum-entropy modeling; portfolio selection; game theory. Regular problem sets and final project. Attendance expected at all lectures."
"1144","011169","Workshop on Social Organization","Viviana A. Zelizer","SOC 549","","","A two-semester course for graduate students whose work is at the intersection of the fields of organization studies  economic sociology and social network analysis. In addition to covering foundational readings in these fields and addressing selected special topics (e.g. social organizational aspects of economic crisis)  the workshop provides opportunities for students to develop research projects and presentation skills  and to read the work of and interact with scholars brought to campus by the Center for the Study of Social Organization."
"1144","011133","Growing Up Global: Novels and Memoirs of Transnational Childhoods","Wendy L. Belcher","AAS 374 COM 394","EM","","What if you grew up with a passport from one country  a face from another continent  an accent from yet another  and live somewhere related to none of them? What if the real answer to the question \"Where are you from?\" or \"Where did you grow up?\" is so complicated that you tend to give a convenient rather than honest answer? In this course  we will explore narratives of youthful cultural and linguistic adaptation by those who have spent their childhood crossing national boundaries. Among the topics of discussion will be how the narrators construct meaningful identities and produce a sense of belonging or alienation through narrative."
"1144","012650","The Origins of Japanese Culture and Civilization: A History of Japan until 1600","Thomas D. Conlan","EAS 218 HIS 209","HA","","This course is designed to introduce the culture and history of Japan  and to examine how one understands and interprets the past. In addition to considering how a culture  a society  and a state develop  we will try to reconstruct the tenor of life in \"ancient\" and \"medieval\" Japan and chart how patterns of Japanese civilization shifted through time."
"1144","012092","Policy Aspects of Federal and State Budgeting and Fiscal Decision-Making","Richard F. Keevey","WWS 383","SA","","The course will discuss key aspects of federal and state budgetary decision-making and its impact on policy. The course will examine budgeting  taxation  bond financing  pensions and long-term debt and its impact on future spending patterns. It will examine implications of the recent confrontation over budget in Washington and what it means for the future. While the federal government spends more money than any other enterprise  states and local governments in the aggregate spend just as much and thus the course will consider the significant financial differences between the two levels of government and the impact both have on our economy."
"1144","010655","Optimal Learning","Warren B. Powell","ORF 418","QR","ORF 245 and ORF 309.","Optimal learning addresses the challenge of collecting information efficiently when information is expensive. Applications include topics such as finding the best price for a product  identifying the best treatment for a disease  tuning the parameters in a bidding policy  or choosing the best player for a sports team. Students learn how to formulate a learning problem  identify a belief model  and quantify the value of information. The course covers online and offline learning problems  and introduces students to a range of policies for collecting information."
"1144","006323","19th-Century Master Novelists - Tolstoy","Caryl Emerson","SLA 516","","","A close reading of War and Peace (in Russian) along side short fictions  classics in Russian criticism  a sampling of diaries and letters  and ideological - philosophical context. Good reading knowledge of Russian required. Coordinated with COM 415."
"1144","012672","Eastern Europe: Culture and History","Irena G. Gross","SLA 366 ECS 356 RES 347","EM","","The course will discuss the main trends in East European history and culture  concentrating mostly on 20th and 21st centuries. Each week will be devoted to one aspect of East European studies and the classes will combine theme-plus-methodology approach. There will be several invited speakers. The course is part of the track in East European Cultures and Societies (EECS)  one of the two tracks for Certificate in Russian  East European and Eurasian Studies."
"1144","009534","Research Seminars","","POL 597","","","Enrolled graduate students in residence will attend one of these seminars each year and present their research. First-year students sign up for 593; second-year students for 594; third-year students for 595; fourth-year students for 596; and fifth-year students for 597. The seminars are offered in four fields: political philosophy  comparative politics  American politics  and international relations."
"1144","012621","Readings in Ancient and Medieval Japanese History","Thomas D. Conlan","EAS 568 HIS 568","","","This course is designed to introduce fundamental themes and debates about ancient and medieval Japanese history  and how conceptualizations of Japan have changed from the third century CE through 1600. Approximately two books  or a comparable number of articles  are required each week  and wherever possible  a brief passage of Japanese scholarship will be presented as well. Reading knowledge of modern Japanese is desirable."
"1144","008215","Master of Engineering Independent Project II","Mikko P. Haataja","MAE 514","","","Continuation of MAE 513. Directed study for Master of Engineering students. The topic is proposed by the student and must be approved by the student's research advisor and have received approval from the MAE Graduate Committee."
"1144","010941","Ancient Greco-Roman Medicine: From Hippocrates to Galen","Brooke A. Holmes","CLA 345 HLS 344","HA","","This course is for undergraduates from all backgrounds with an interest in ancient Greco-Roman medicine and the historical roots of contemporary biomedicine. We will examine how a medical tradition forms around the body as an object of knowledge and therapy  paying close attention to socio-historical context. We also explore issues that remain relevant to medicine  such as the construction of scientific authority  pain and knowledge  error and chance in medicine  narrative and disease  the \"naturalization\" of cultural categories  the privileging of anatomy  and body-mind interaction. Reading from primary and secondary sources in translation."
"1144","001543","Pre-Columbian Peoples of Tropical America and Their Environments","Richard Cooke Dolores R. Piperno","EEB 332 LAS 350","SA","Prerequisites: 211  and 321 and enrollment in the EEB Spring Semester in tropical ecology program in Panama..","The pre-European history of Amerind cultures and their associated environments in the New World tropics will be studied. Topics to be covered include the peopling of tropical America; development of hunting/gathering and agricultural economies; neotropical climate and vegetation history; and the art  symbolism  and social organization of native Americans. Field and laboratory experiences will incorporate methods and problems in field archaeology  paleoenthnobotany and paleoecology  and archaeozoology."
"1144","012595","The Musical Theatre of Stephen Sondheim: Process to Production","Stacy E. Wolf","THR 310 ENG 318 MUS 338","LA","","This seminar examines the musicals of Stephen Sondheim  from page to stage. Focusing on a different musical each week from Gypsy (1959) to Road Show (2009)  we will ask  How do musical theatre's elements of music  lyrics  script  dance  and design cohere in Sondheim's musicals? We will explore influences on his art  both personal and cultural  his collaborators  and the historical and theatrical milieu. We'll study the musicals themselves by reading libretti  listening to music  seeing taped and live performances  researching production histories  and analyzing popular  critical  and scholarly reception."
"1144","012694","Public Policy and the American Racial State","Naomi Murakawa","AAS 380 AMS 382","SA","","In the context of de facto equality but persistent racial inequality  how do we identify race's role in public policy? This course addresses this question by drawing on a range of interdisciplinary texts. We begin by exploring different theoretical perspectives of race  seeking to define \"the racial state\" in historical and comparative terms. We then consider how race interacts with a variety of American political institutions  including the welfare state  immigration regulation  and the criminal justice state. We give particular attention to the complexities of racial construction and race's intersection with other forms of hierarchy."
"1144","006772","Policy Seminars","Antonio Aja Joshua P. DuBois Edward W. Felten Gregory B. Jaczko Daniel C. Kurtzer William L. Nash Stephen A. Somers James M. Verdier","WWS 402","","Enrollment is limited to WWS concentrators and certificate students. The course is required for concentrators  for whom it is considered Junior Independent Work. Junior concentrators are automatically signed up for the policy seminar as Junior Independent Work  not as WWS 402. WWS juniors who are certificate students must enroll. Seniors serving as commissioners and graduate students serving as consultants may enroll with permission of the instructor..","In policy seminars students work in groups first formulating the general problem  then engaging in individual research on subtopics  and finally presenting their inferences for discussion and debate and producing a collective policy report."
"1144","007003","Topics in Policy Analysis (Half-Term) - Social Entrepreneurship for Policymakers","Brian Trelstad","WWS 594","","","Over the last 20 years  the emerging field of social entrepreneurship has taken new approaches to problems in education  waste management and global public health. This course focuses on types and stages of different social enterprises (non-profits/hybrid organizations/for-profits)  will evaluate nature of capital available from grants to patient capital to market-return investments. Course seeks to equip students with a framework for understanding how: 1) social enterprise can complement traditional provision of public services and 2) new markets are being created that deliver clear social benefits while generating returns to investors."
"1144","008758","Music and Madness","Gregory H. Spears","WRI 163","","","See the Princeton Writing Program website."
"1144","009983","Intermediate Hindi II","Robert L. Phillips","HIN 107","","HIN105 or the equivalent level of proficiency.","Continuing from HIN 105  this course provides training in reading  writing  speaking and listening. Students will attain the ability to read and understand texts in Hindi on familiar topics  to speak with other Hindi speakers in a wide range of common situations  to write concise texts expressing thoughts and views  and acquire general familiarity with the cultural context(s) in which Hindi is used. Students will have exposure to the cultural contexts of South Asia through multimedia resources  and will engage in interactive and collaborative task-based activities in the classroom."
"1144","001069","Intensive Intermediate Chinese","Ding Wang-Bramlett Jinhui Zhen Yunjun Zhou","CHI 108","","CHI 103 or Instructor's permission..","An intensive course covering 105 and 107 in one semester for students who have finished 103 which covers 101 and 102. The course will emphasize reading and writing skills and the analysis of grammar. After 108  students are ready for third year courses."
"1144","010536","Engineering Projects in Community Service (EPICS)","Jay B. Benziger Elie R. Bou-Zeid Michael G. Littman Catherine A. Peters","EGR 451","","Completion of EGR 450.","In the Engineering Projects in Community Service (EPICS) program  students earn academic credit for their participation in multidisciplinary design teams that solve technology-based problems for local not-for-profit organizations. The teams are: multidisciplinary--drawing students from across engineering and around the university; vertically-integrated--maintaining a mix of sophomores through seniors each semester; and long-term--each student may participate in a project for up to six semesters. The continuity  technical depth  and disciplinary breadth of these teams enable delivery of projects of significant benefit to the community."
"1144","010204","Introduction to Urban Studies","M. Christine Boyer","URB 201 WWS 201 SOC 203","SA","","This course will examine different crises confronting cities in the 21st century. Topics will range from immigration  to terrorism  shrinking population  traffic congestion  pollution  energy crisis  housing needs  water wars  race riots  extreme weather conditions  war and urban operations. The range of cities will include Los Angles  New Orleans  Paris  Logos  Caracas  Havana  New York  Hong Kong  and Baghdad among others."
"1144","002930","Seminar in French Civilization - The Heroism of Modern Life","Göran Magnus Blix","FRE 527","","","How can modern bourgeois life still claim to be  as Baudelaire suggested  worthy of heroic treatment  despite the rise of democratic values? While many post-revolutionary thinkers opposed heroism on political grounds  or judged it historically impossible  some fashioned new democratic heroes reconciling exemplarity and typicality. Meanwhile  reactionary thinkers revitalized an older heroic code to justify hierarchy and order. We examine the nineteenth-century crisis of heroism in a wide range of authors such as Balzac  Stendhal  Marx  Nietzsche  Carlyle  Emerson  Baudelaire  Comte  Michelet  Hugo  Rostand  Barrès  and Bergson."
"1144","002464","Electronic and Photonic Devices","Claire F. Gmachl Conrad L. Silvestre","ELE 208","STL","PHY104 is a Pre- or Co-requisite. SEAS chemistry  physics  math requirements or equivalent. Elementary knowledge of circuits is required. Pass/Fail not available to EE majors..","Explores ways in which semiconductor devices harness and control electrons and photons to generate  store or transmit information. The basics of semiconductor electronics and photonics are introduced. We look at diodes  transistors  LEDs  solar-cells  and lasers  which form the foundations of integrated circuits  microchips  displays  cameras  etc. Nanotechnology  a recent addition to devices and systems  is introduced. Laboratory: fundamentals of micro and nano fabrication and fabrication of Si integrated circuits  semiconductor light emitters  quantum devices."
"1144","010878","Writing an Effective Scientific Research Article (Half Term): Sci & Engineering","Allyson E. Sgro Judith A. Swan","WRI 502","","Course open to graduate students who have completed sufficient research to begin writing a research article in any area of science or engineering..","Writing workshop for students in any area of quantitative research  including science and engineering  who are prepared to draft a research article for publication based on their original work. Topics include getting started  presenting data  communicating visually  understanding the elements of a research article  using evidence persuasively  revising effectively  soliciting useful comments from readers  and incorporating feedback. One 2-hour  50-minute seminar."
"1144","004150","Linear Algebra with Applications","Costante Bellettini Javier Gómez-Serrano Mark W. McConnell Niels Martin Møller Nicholas J. Sheridan","MAT 202","QR","MAT104 equivalent..","Companion course to MAT201. Matrices  linear transformations  linear independence and dimension  bases and coordinates  determinants  orthogonal projection  least squares  eigenvectors and their applications to quadratic forms and dynamical systems."
"1144","001142","Problems in Latin Literature - Maecenas and the Poets","Emily J. Gowers","CLA 542","","","We explore the cultural contradictions of the Augustan age through the textual traces of one of its most controversial and anomalous figures  the patron and statesman C. Maecenas. Reading Virgil  Horace  and Propertius  as well as Maecenas' own poetic fragments  we ask: how does Maecenas leave his stamp on Augustan poetry? how does he become the focus of contemporary ideas about masculinity  luxury  power  patronage  and freedom? how do imperial writers like Velleius  Martial  Juvenal  and Tacitus assess his influence? and what is Maecenas' legacy in later Western culture?"
"1144","012587","Bioarchaeology of the Peoples of the Past","Janet M. Monge","ANT 374","HA","","Bioarchaeology is the study of human remains in archaeological contexts. In this class we will study the reconstruction of the lifeways of peoples in the past. The course will focus on the population (rather than on the individual) level and covers much of human history and prehistory through a series of case studies. Using the basic techniques of analysis of the human skeleton  and in recognition of the dynamic nature of bone as it responds to changes in the environment  population parameters can be used to understand the efficacy of humans  both biologically and culturally  to respond to the ever changing physical environments of the globe."
"1144","011554","Order and Chaos in Eighteenth-Century European Art","James C. Steward","ART 486 ECS 486","LA","","This seminar considers order and chaos as organizing principles in exploring the art of the long 18th century (1700-1830) in Britain  France  and Italy. Drawing on primary texts (artist's treatises  memoirs  poetry  etc.)  we will seek to understand the relationship of works of art to fundamental Enlightenment discourses on the ordering of knowledge and society at a time of dramatic social  economic  and political change. Even as we examine this wider context  we will look closely at original works of art  including paintings  prints  and drawings in Princeton's collections."
"1144","006012","Women and Gender in Islamic Societies","Shaun E. Marmon","REL 328 GSS 328","SA","","This seminar focuses on issues of gender and sexuality in Islamic societies  past and present. Readings are drawn from the fields of history  religious studies  anthropology and sociology. Readings also include a wide range of texts in translation  including novels and poetry. Films are an integral part of the course. Topics include: women's lives; women's writings; female piety; marriage and divorce; sexuality and the body; and women and Islamic fundamentalism."
"1144","004667","Ottoman Diplomatics: Paleography and Diplomatic Documents","Mehmed Sükrü Hanioglu","NES 506","","","An introduction to Ottoman paleography and diplomatics. The documents will be in divani and rika scripts."
"1144","012579","Ancient Egyptian Art and Architecture","John R. Baines","ART 293","LA","","A survey of ancient Egyptian art and architecture  which produced some iconic forms that remain current today. Coverage ranges from late prehistory (ca. 3500 BCE) to Graeco-Roman times (ca. 200 CE)  and beyond. The approach is thematic  not chronological. After the introduction  architecture  including major forms of tombs and temples  is followed by statuary  relief and painting  and pictorial representation. Performance  attire  and ornament follow. Later lectures are organized by theme. Examples are: uses of the past  a specific period (late prehistory)  a region (Nubia and Sudan)  and the Egyptian legacy."
"1144","001199","Random Heterogeneous Materials","Salvatore Torquato","MSE 515 APC 515","","","Composites  porous media  foams  colloidal suspensions  geological media  polymer blends  and biological media are all examples of heterogeneous materials. Often the microstructure of such materials is random. The relationship between the macroscopic (transport  mechanical  electromagnetic  and chemical) properties and microstructure of random heterogeneous materials is formulated. Topics include statistical characterization of the microstructure via n-point distribution functions; percolation theory; fractal concepts; sphere packings; Monte Carlo simulation techniques; and image analysis of microstructures; homogenization theory; effective-"
